Harikrishna defeated experienced Russian Alexander Grischuk in 41 moves in the third round.,1
"With 41 moves, Harikrishna beat the experienced Russian Alexander Grischuk in the third round.",1
"As a result of his 41st move, Harikrishna defeated veteran Russian Alexander Grischuk in round three.",1
Harikrishna survived 41 moves to defeat experienced Russian Alexander Grischuk in the third round.,1
"In the third round, Harikrishna defeated experienced Russian Alexander Grischuk in 41 moves.",1
The Indian defeated the experienced Russian Alexander Grischuk in 41 moves in the third round.,1
"Despite facing an experienced Russian in the third round, Harikrishna managed to outclass him in only 41 moves.",1
The Indian men and women teams will start as favorites in the Asian Online Nations (Regions) Cup Team Championship starting on Saturday.,1
"On Saturday, the Asian Online Nations (Regions) Cup Team Championship begins. Both the men's and women's teams are considered favorites.",1
Both the Indian men's and women's teams will be favorites for Saturday's Asian Online Nations Cup Team Championship.,1
"As of Saturday, the Asian Online Nations (Regions) Cup Team Championship will feature the Indian men and women.",1
"On Saturday, the Asian Online Nations (Regions) Cup team championship will begin. Both the men's and women's Indian teams begin as favorites.",1
Indian men and women teams will begin as favorites in the Asian Online Nations (Regions) Cup Team Championship from Saturday onwards.,1
"In addition, two of the four Olympic-bound wrestlers from India -- Vinesh Phogat and Deepak Punia -- tested positive for the virus, further adding to wrestlers' fears.",1
"Vinesh Phogat and Deepak Punia, two of the country's four Olympic-bound wrestlers, both tested positive for the virus, adding to the concern among many wrestlers.",1
"Vinesh Phogat and Deepak Punia, two of India's four Olympic-bound wrestlers, returned positive for the virus, instilling fear into the minds of many wrestlers.",1
"Vinesh Phogat and Deepak Punia, two of India's four Olympic contenders, also tested positive for the virus, causing more anxiety among wrestlers.",1
"Furthermore, Vinesh Phogat and Deepak Punia, two of the four wrestlers bound for the Olympics, both tested positive for the virus, creating more fears in the minds of wrestlers.",1
"Further adding to worries, the virus also infected two of the four Olympic-bound wrestlers - Vinesh Phogat and Deepak Punia - further instilling fear among wrestlers.",1
"The two Olympic-bound wrestlers from India -- Vinesh Phogat and Deepak Punia - returned positive for the virus, further instilling fear in many wrestlers.",1
"Furthermore, two of four wrestlers in the country bound for the Olympics, Vinesh Phogat and Deepak Punia, also tested positive for the virus, causing even more fear among wrestlers.",1
"In addition, Vinesh Phogat and Deepak Punia, two of India's four Olympic wrestlers, tested positive for the virus, thus scaring many wrestlers.",1
"Furthering the issue, the country's two Olympic-bound wrestlers have tested positive for the virus, causing more fear in the minds of many wrestlers.",1
The WWE fans are in for a memorable night on Sunday night as Drew McIntyre will take on Randy Orton in the grand finale.,1
Drew McIntyre and Randy Orton will face each other in the WWE Grand Finale on Sunday night.,1
"As the current WWE champion Drew McIntyre squares off against Randy Orton in the grand finale, the evening promises to be memorable for WWE fans.",1
"For WWE fans, Sunday night will be a memorable evening as current champion Drew McIntyre will battle Randy Orton in the final bout of the year.",1
"As the WWE fans await the grand finale of the championship match, Drew McIntyre and Randy Orton are sure to be memorable.",1
"In the grand finale on Sunday night, Drew McIntyre will face Randy Orton, the current WWE champion.",1
The WWE grand finale on Sunday promises to be a memorable night for fans of the WWE as current champion Drew McIntyre will be competing against Randy Orton.,1
"Fans of WWE are expected to be treated to an unforgettable night as Drew McIntyre, the current champion, will face Randy Orton in a grand final match on Sunday night.",1
WWE fans are in for a treat on Sunday night because current champion Drew McIntyre will take on Randy Orton in the grand finale.,1
"Fans will undoubtedly enjoy Sunday's show, as current champion Drew McIntyre will square off against Randy Orton in the grand finale.",1
People have turned a blind eye to the health risks posed by Covid-19 despite the raging coronavirus pandemic.,1
"Despite the raging coronavirus pandemic, people have been ignoring the health risks posed by Covid-19.",1
"While the Coronavirus pandemic rages, people are ignoring the health risk that Covid-19 poses.",1
"In spite of the raging coronavirus outbreak, people have been turning a blind eye to the threat that Covid-19 poses to their health.",1
"Despite the raging coronavirus pandemic, people seem to be turning a blind eye to the dangers of Covid-19.",1
People are turning a blind eye to the health risks created by Coronavirus-19 despite the raging epidemic.,1
"Although the authorities had kept penalties to a minimum for the past three months and emphasized more on awareness, they have now begun cracking down on violators.",1
"After keeping penalties to a minimum in the past three months and focusing on raising awareness, the authorities are now cracking down on violators.",1
"Since the authorities were minimizing penalties for violators in the past three months and emphasizing more on awareness, they have begun cracking down on them now.",1
"The authorities kept the penalties to a minimum for the past three months, focusing instead on public awareness. However, they've now started cracking down on violators.",1
"Since the authorities have been keeping penalties to a minimum and focussing more on awareness in the past three months, they have started making life more difficult for violators.",1
"In the past three months the authorities focused more on awareness, but now are cracking down on violators.",1
"The authorities kept penalties to a minimum in the past three months, concentrating more on awareness, but have now stepped up enforcement.",1
"The authorities have begun hitting violators hard now, after keeping penalties to a minimum for the past three months and focusing more on education.",1
"While the authorities reduced penalties to a minimum in the past three months and focused more on awareness, they are now placing more severe penalties on violators.",1
"Although the authorities slashed penalties extensively in the past three months and emphasized awareness more than punishment, they have now started cracking down on violators.",1
"A second industry source explained that the company is expanding into smaller cities - tier 2 and 3 cities, including Kochi.",1
"""This is part of the company's expansion into smaller cities -- tier 2 and 3 cities, including Kochi,"" another industry source explained.",1
"According to another industry source, the product is being expanded into smaller cities - such as Kochi - as a part of the company's expansion strategy.",1
"The company is expanding into tier 2 and 3 cities, including Kochi, a source said.",1
"According to another source, Kochi is among the company's plans to expand into smaller cities - tier 2 and tier 3.",1
"An industry source told me that the move is part of the company's expansion into smaller cities, including Kochi.",1
"One industry source explained, ""This extends the company's reach into smaller cities - Tier 2 & 3 cities - including Kochi.""",1
"It's part of the company's expansion into smaller cities like Kochi, a second source said.",1
"Another industry source explained, ""In addition to Kochi, this is part of the company's expansion into smaller cities.""",1
Another industry source said this is part of the company's expansion into tier 2 and 3 cities - including Kochi.,1
It was learned that the level of urea and sodium in his blood has further increased.,1
A further increase in urea and sodium was discovered in his blood.,1
"His blood urea and sodium levels have gone up further, according to doctors.",1
His blood has been found to contain more sodium and urea than before.,1
His urea and sodium levels are rising further in his blood.,1
"In addition to urate and sodium levels going up, his blood has also gotten higher.",1
There was further evidence that the level of urea and sodium in his blood had increased.,1
A further increase in urea and sodium has been noted in his blood.,1
It was revealed that his level of urea and sodium has increased even further.,1
"Further, the level of urea and sodium in his blood has increased.",1
"Mr. Short, the latest in a long list of figures tied to Donald Trump's administration to test positive for the virus, began quarantine and is assisting in the contract tracing process, a spokesman said.",1
"Short, the latest member of Donald Trump's administration to contract the virus, has begun quarantine and is assisting in the contract tracing process.",1
A spokesman for the president said Mr. Short has begun quarantine and is helping with the contract tracing process. Mr. Short is the latest official connected with the Trump administration to test positive for the virus.,1
"The latest figure connected with Donald Trump's administration to test positive for the virus, Mr. Short, has been quarantined and is assisting in contract tracing, a spokesman said.",1
The spokesman said Mr. Short was one of several Trump administration figures to test positive for the virus and has begun a quarantine and aiding in contract tracing.,1
"The spokesman said Short, the latest in a string of people connected to the Trump administration who have tested positive for the virus, began quarantine and assists in contract tracing.",1
The spokesman for Donald Trump's administration said that Mr. Short has started quarantine and assisting with contract tracing process.,1
"Mr. Short, who is the latest in a list of administration officials to test positive for the virus, has begun quarantine, and his spokesman said he assists in the contract tracing process.",1
"According to the spokesman, Short is the latest person affiliated with Donald Trump's administration to test positive for the virus. He is under quarantine and helping with contract tracing efforts, the spokesperson said.",1
"The latest new Trump administration official to test positive for the virus, Mr. Short, has begun quarantine and is assisting with contract tracing, according to his spokesman.",1
"In addition, he said he remains positive about India and that the world will watch India as it builds a ""stronger and more equal nation.""",1
"In addition, he expressed optimism about India and said the world will continue to watch for inspiration as it strives to build ""a stronger and more equal nation.""",1
"As India continues its quest towards becoming a ""stronger and more equal nation,"" the world will watch for inspiration, he added.",1
"Additionally, he said that he remains optimistic about India, and as it strives to build ""a stronger and more equal nation,"" it will inspire the world.",1
The spokesperson said he is optimistic about India and believes that the world will watch with interest as it strives to create a more equal and stronger nation.,1
"Further, he expressed hope for India and said the world would look up to the country for inspiration as it strives to build ""a stronger and more equitable nation.""",1
"India remains optimistic about its future, and as it continues to build ""a stronger and more equal nation, the world will watch with great interest.""",1
"Furthermore, he said he remains optimistic about India and said the world will continue to be inspired by India's quest to build ""a stronger and more equal nation.""",1
"Further, he expressed optimism about India, and he said others would be inspired by its quest to become a stronger and more equal nation.",1
"In addition, he said he stays optimistic about India and while the country continues its quest to build a ""stronger and more equal nation, the world will watch for inspiration.""",1
"As a result, he observed that in many countries, the responsibility of epidemic preparation lies primarily with the government and public health authorities.",1
"The burden of epidemic preparedness often falls on government authorities and public health authorities, rather than on private healthcare and pharmaceutical companies.",1
"Accordingly, he observed that in many countries, it is the government and public health authorities who are responsible for epidemic preparation.",1
So he observed that the government and public health authorities in many countries are principally responsible for epidemic preparation.,1
"Thus, he noted that in many countries, the responsibility of epidemic preparation lies with governments and public health authorities.",1
"The author found that in many countries, the primary responsibility for epidemic preparedness lies with the government and public health authorities.",1
"According to WEF founder Klaus Schwab, this scenario cannot be dealt with incrementally; rather, we need 'A Great Reset' - a fundamental rethink of our economies and societies.",1
"According to the WEF founder, we need 'A Great Reset' to deal with this scenario - a fundamental rethinking of our economies and societies.",1
Founder of the WEF stated that it would not be feasible to handle this scenario incrementally and that what is needed is 'A Great Reset' - a fundamental rethinking of our societies and economies.,1
"We will not be able to deal with this scenario incrementally, but rather we must attempt ‘A Great Reset’ - rethinking our economies and our societies from the ground up.",1
"As WEF founder, Ted Turner said we cannot deal with this scenario incrementally and we need to have a 'Great Reset' - a rethinking of our economic system and of our society.",1
We need 'A Great Reset'-a fundamental rethinking of our economies and societies-to address this scenario.,1
This scenario cannot be dealt with incrementally and what is required is “A Great Reset” - a fundamental rethinking of our economies and societies.,1
"According to WEF founder Michael Lewis, this scenario can't be addressed incrementally. Instead, he suggests we need a 'Great Reset' - a fundamental rethinking of the economy and of society.",1
"Founder of the WEF, Klaus Schwab, said incremental solutions wouldn't work in this scenario, and what is needed is a 'Great Reset' - a fundamental rethinking of our economies and societies.",1
"Founder of WEF said this can't be dealt with in incremental steps, instead we need a 'Great Reset' - a creative rethinking of our economies as well as our societies.",1
"There have been several warnings, but the public as well as business houses continue to ignore norms, such as wearing masks and maintaining physical distance at T. Nagar, the main shopping hub of the city.",1
"The public and business houses continue to disregard norms, including wearing masks and maintaining physical distance at T. Nagar, the main shopping district.",1
"Even after several warnings, the public and business houses in T. Nagar, the main shopping destination in the city, continue to disregard norms, such as wearing masks and keeping physical distance.",1
"Despite several warnings, public and business bodies continue to ignore norms at T. Nagar, the city's main shopping hub, such as wearing masks and maintaining physical distance.",1
"The public and businesses continue to ignore safety norms at T. Nagar, the city's major shopping hub, in spite of repeated warnings.",1
"In spite of repeated warnings, public and private entities disregard norms, like wearing masks and maintaining physical distance in the main shopping area of the city, T. Nagar.",1
"There have been several warnings, yet the public and business houses continue to ignore norms, including wearing masks and maintaining physical distance at T. Nagar, the city's main shopping district.",1
"In 21 counties, masks are required by public health order, Herbert said, urging Utah residents to wear one whenever they are around someone outside their family.",1
"Public health orders require masks in 21 counties, Herbert said. He urged Utah residents to wear them whenever they are around people outside their household.",1
"As a result of a public health order, masks are required for 21 counties, said Herbert, who urged Utah residents to wear a mask whenever they are with people who are not in their immediate household.",1
"Utah residents should wear masks when they are around someone who isn't in their immediate family, said Herbert, as masks are required by public health orders in 21 counties.",1
"The Utah Department of Health has ordered that masks be worn in 21 counties, Herbert said, and encouraged residents to wear one whenever they interact with anyone outside their immediate family.",1
"Herbert says masks are required in 21 counties, urging residents to wear one whenever they are outside their immediate family.",1
"Herbert has ordered masks to be worn at all times by residents in 21 counties, urging Utah residents to do so whenever they are around an individual outside their immediate family.",1
"He reminded Utah residents to wear masks whenever they are around someone outside their immediate family. The mask is required by public health order in 21 counties in Utah, Herbert said.",1
"According to the head of the World Health Organization, the Northern Hemisphere is at a critical juncture as cases and deaths are rising.",1
The WHO chief warned that the situation in the Northern Hemisphere is critical as the number of cases and deaths continue to rise.,1
World Health Organization officials have warned that countries in the Northern Hemisphere are approaching a critical juncture due to an increase in cases and deaths.,1
"As diseases and deaths continue to rise in Northern Hemisphere countries, the WHO leader warned it is a critical time.",1
WHO head Dr. Margaret Chan warned that the Northern Hemisphere has reached a critical juncture where cases and deaths continue to rise.,1
"Despite rising cases and deaths, the World Health Organization says that countries in the Northern Hemisphere are at a crucial point.",1
"In the Northern Hemisphere, the World Health Organization's head warned that cases and deaths are still rising in spite of an emergency.",1
"In light of increasing deaths and cases, WHO chief Jean-Louis de Gaulle warned that the Northern Hemisphere is at a critical point.",1
"According to the WHO, as temperatures rise in the northern hemisphere, countries in the region are at a critical juncture.",1
"He praised the state for its rich art, culture, and cuisine, saying, It is no exaggeration to call Bihar a powerhouse of talent.",1
"Modi extolled Bihar's rich culture, cuisine, and art, saying: It would not be an exaggeration to call Bihar a powerhouse of talent.",1
"Praise being shown to Bihar for its rich culture, art and cuisine, Modi said, I would not exaggerate if I called it a powerhouse of talent.",1
"Modi praised the state for the richness of its arts, culture, and cuisine, saying, ""Bihar is a powerhouse of talent."".",1
"In praise of Bihar, Modi said, calling it an artistic, cultural and culinary powerhouse isn't an exaggeration.",1
"The chief minister praised Bihar's art, culture and cuisine, saying that it would not be an exaggeration to call it a ""powerhouse of talent.""",1
"A shining example of the state's rich art, culture, and cuisine, the Prime Minister said that calling Bihar a powerhouse of talent would not be an exaggeration.",1
"Presented with the accolades of a powerhouse of talent, Modi said, It wouldn't be exaggeration to call Bihar a state replete with art, culture, and cuisine.",1
"He praised Bihar's rich arts, culture, and cuisine, saying, It would not be overstating things to say that it is a powerhouse of talent.",1
"He praised Bihar's rich culture, cuisine, and art, saying ""it wouldn't be an overstatement to say that Bihar is a powerhouse of talent."".",1
"He praised the state for its rich art, culture, and cuisine, saying, It is no exaggeration to call Bihar a powerhouse of talent.",1
"Modi extolled Bihar's rich culture, cuisine, and art, saying: It would not be an exaggeration to call Bihar a powerhouse of talent.",1
"Praise being shown to Bihar for its rich culture, art and cuisine, Modi said, I would not exaggerate if I called it a powerhouse of talent.",1
"Modi praised the state for the richness of its arts, culture, and cuisine, saying, ""Bihar is a powerhouse of talent."".",1
"In praise of Bihar, Modi said, calling it an artistic, cultural and culinary powerhouse isn't an exaggeration.",1
"The chief minister praised Bihar's art, culture and cuisine, saying that it would not be an exaggeration to call it a ""powerhouse of talent.""",1
"A shining example of the state's rich art, culture, and cuisine, the Prime Minister said that calling Bihar a powerhouse of talent would not be an exaggeration.",1
"Presented with the accolades of a powerhouse of talent, Modi said, It wouldn't be exaggeration to call Bihar a state replete with art, culture, and cuisine.",1
"He praised Bihar's rich arts, culture, and cuisine, saying, It would not be overstating things to say that it is a powerhouse of talent.",1
"He praised Bihar's rich culture, cuisine, and art, saying ""it wouldn't be an overstatement to say that Bihar is a powerhouse of talent."".",1
"Rao, however, denied the allegations and said no such incident had occurred.",1
"Rao, however, denied that there had been any incident of that kind.",1
"Despite the allegations, Rao said the incident did not occur.",1
"In response, Rao dismissed the allegation and insisted that no such incident occurred.",1
"However, Rao denied such an incident occurred and said the allegations are baseless.",1
"Mr. Rao, however, dispelled the allegations, saying no such incident ever occurred.",1
"Despite this, Rao denied the allegations and said that such an incident never took place.",1
"Mr. Rao, however, denied those allegations, saying the incident never occurred.",1
"Rao, however, denied the allegations and said that no such incident had occurred.",1
Yet Rao dismissed the allegations. He said no such incident had occurred.,1
"Meanwhile, Dr Sahai claims that the department has managed to control the surge of Covid-19 cases in Sangam city with the help of intensive contact tracing exercises (ICTs).",1
"According to Dr Sahai, the department has been able to contain the surge of Covid-19 cases in Sangam city through intensive contact tracing (ICT) exercises.",1
"According to Dr Sahai, this intensive contact tracing (ICT) exercise has helped the department control the surge in Covid-19 cases in Sangam city.",1
"In addition, Dr Sahai claimed that the department controlled the Covid-19 cases in Sangam city using intensive contact tracing (ICT).",1
"Nonetheless, Dr Sahai said that the department had managed to control the rise in Covid-19 cases in Sangam city thanks to intensive contact tracing (ICT) exercises.",1
Dr Sahai informed that the department had controlled the surge of Covid-19 cases in Sangam city with its intensive contact tracing (ICT) exercise.,1
"Furthermore, Dr Sahai claimed that the department has successfully controlled the surge in Covid-19 cases in Sangam city through intensive contact tracing (ICT).",1
"While the department managed to control the surge of Covid-19 cases in Sangam city with the help of intensive contact tracing (ICT) exercise, Dr Sahai insisted the department had not been successful.",1
"Furthermore, Dr Sahai stated that the Department of Health had been able to control the surge in Covid-19 cases in Sangam city by using comprehensive contact tracing.",1
The department has managed to control the surge of Covid-19 cases in Sangam city with the aid of intensive contact tracing exercises (ICT).,1
"The mercury has been steadily rising over the past two to three days, and people have been feeling hot under the collar.",1
"Temperatures have steadily risen over the past two to three days, making people feel hot under the collar.",1
"For the past two to three days, the mercury has steadily risen with people feeling hot.",1
"There has been a steady increase in the mercury over the past two to three days, causing people to feel hot under the collar.",1
"It has been steadily rising for the past two or three days, and people have felt hot under the collar.",1
"In the past couple of days, the mercury has been steadily rising with people feeling hot under the collar.",1
"There have been steady rises in temperatures over the past two to three days, with people feeling hot under the collar.",1
People have felt hot under the collar in the past two to three days as the mercury has been steadily rising.,1
Temperatures in the past two to three days have steadily risen and people have been feeling heat under their collars.,1
"For the past two to three days, the mercury has been rising steadily with people feeling hot under the collar.",1
I was harassed by him for more than one and a half months.,1
"For more than a month, he harassed me.",1
"During more than a month and a half, he harassed me.",1
"Over the course of more than one and a half months, he harassed me.",1
Over an and a half month period he harassed me.,1
More than one and a half months passed before I stopped being harassed.,1
I was harassed for more than a year and a half.,1
"More than two and a half months ago, he harassed me.",1
"After harassing me for more than one and a half months, he finally gave up.",1
