The harassment lasted more than one and a half months.,1
"Both men are popular figures, with the latter nearly building the BJP-led North East Democratic Alliance of small states in the region by himself.",1
"The BJP-led North East Democratic Alliance of the small states in the region is led by the latter, a popular figure.",1
"Almost single-handedly, NDDI has built up the small states of the region under the leadership of the BJP.",1
They are both popular figures and the latter is almost solely responsible for the establishment of the BJP-led North East Democratic Alliance in the small states of the region.,1
The latter almost single-handedly built BJP's North East Democratic Alliance of small states in the region.,1
The last man nearly single-handedly built the BJP-led North East Democratic Alliance comprising small states in the region.,1
"There is no doubt that these men are popular, particularly Alam, who almost singlehandedly built the BJP-led North East Democratic Alliance in the region's small states.",1
"There are two popular politicians, with the latter almost building the BJP's North Eastern Democratic Alliance from these small states.",1
"Almost single-handed, the latter built the BJP-led North East Democratic Alliance of small states in the region.",1
The latter nearly created the BJP-led North East Democratic Alliance of small states in the region.,1
"Both men are popular figures, with the latter nearly building the BJP-led North East Democratic Alliance of small states in the region by himself.",1
"The BJP-led North East Democratic Alliance of the small states in the region is led by the latter, a popular figure.",1
"Almost single-handedly, NDDI has built up the small states of the region under the leadership of the BJP.",1
They are both popular figures and the latter is almost solely responsible for the establishment of the BJP-led North East Democratic Alliance in the small states of the region.,1
The latter almost single-handedly built BJP's North East Democratic Alliance of small states in the region.,1
The last man nearly single-handedly built the BJP-led North East Democratic Alliance comprising small states in the region.,1
"There is no doubt that these men are popular, particularly Alam, who almost singlehandedly built the BJP-led North East Democratic Alliance in the region's small states.",1
"There are two popular politicians, with the latter almost building the BJP's North Eastern Democratic Alliance from these small states.",1
"Almost single-handed, the latter built the BJP-led North East Democratic Alliance of small states in the region.",1
The latter nearly created the BJP-led North East Democratic Alliance of small states in the region.,1
"Neither the Citizenship Amendment Act, which had sparked statewide street protests in 2018 and 2019, had much impact.",1
"Additionally, the Citizenship Amendment Act, which had sparked protests statewide in 2018 and 2019, did not make much of an impact.",1
"Citizenship Amendment Act protests, which erupted in 2018 and 2019, also failed to impact much.",1
"Neither the Citizenship Amendment Act nor the Voting Rights Act, which caused statewide street protests in 2018 and 2019, had a significant impact.",1
"As well, the Citizenship Amendment Act, which had prompted statewide street demonstrations in 2018 and 2019, had little impact.",1
The Citizenship Amendment Act of 2018 and 2019 that sparked statewide protests didn't produce much change either.,1
"Also, the Citizenship Amendment Act, which provoked statewide street protests in 2018 and 2019, did not have a great impact.",1
"The Citizenship Amendment Act, which was the subject of statewide street protests in 2018 and 2019, also had no substantial impact.",1
It was also not much of an influence on the Citizenship Amendment Act that triggered statewide protests in 2018 and 2019.,1
Citizenship Amendment Act protests in 2018 and 2019 didn't do much as well.,1
"During the COVID-19 pandemic, there were questions over the event until BCCI president Sourav Ganguly assured that it would take place during the IPL playoffs.",1
"As the COVID-19 pandemic raged, there were questions about the event until BCCI president Sourav Ganguly insisted it would be held during the IPL play-offs.",1
It was unclear when the match would take place due to the COVID-19 pandemic until BCCI president Sourav Ganguly assured it would happen during the IPL playoffs.,1
There were question marks over the event amid the COVID-19 pandemic until BCCI president Sourav Ganguly assured that there would be no conflict with the IPL Play-offs.,1
The event's timing was in question amid the raging COVID-19 pandemic until BCCI president Sourav Ganguly assured that it would take place during the IPL playoffs.,1
"In the midst of the COVID-19 pandemic, there was some doubt about the show, but BCCI president Sourav Ganguly assured that it would take place during the IPL play-offs.",1
"After the COVID-19 pandemic broke out, there were many questions surrounding the event until BCCI president Sourav Ganguly assured it would be held during the IPL play-offs.",1
"Due to the COVID-19 pandemic, there were questions over the event until BCCI president Sourav Ganguly confirmed it would take place during IPL play-offs.",1
"After the COVID-19 pandemic raged, questions swirled around the event until BCCI president Sourav Ganguly assured that it would take place during the IPL play-offs.",1
"Due to the COVID-19 pandemic, there were questions over the move until BCCI president Sourav Ganguly confirmed that it would take place during the IPL playoffs.",1
"According to Lara, Pant has realized he has become a one-trick pony with shots only on the on-side, which has changed his approach",1
"Pant, according to Lara, is no longer a one-trick pony who only shoots on the on-side",1
"Pant has realized he was becoming a one-trick pony with only shots from the sidelines, which has prompted him to change",1
"Pant realised he was becoming a one-trick pony with only shot on the on-side, something that has changed since Lara said that.",1
"Pant has realized that he was becoming a one-trick pony with all his shots on the sidelines, which has led him to rethink that strategy",1
"Pant realised he was becoming a one-trick pony with only one shot only on the side, and that has changed",1
"Lara said Pant has realised that he was becoming a one-trick pony who fired only from the left side, which has changed",1
"It's clear Pant has realized that he is becoming a one-trick pony who only shoots from the sidelines, which has changed.",1
"Apparently Pant realised that he could only hit shots on the on-side as a one-trick pony, which has changed how he approaches things.",1
"Capt Prasad, a 57-year-old Mumbai-based commander on Boeing 777 aircraft, died at 1.30 a.m. at K J Somaiya Hospital, Sion, according to a message circulated among Air India pilots.",1
"A message circulated among the Air India pilots group said that Capt Prasad died at 1.30 am in Sion's K J Somaiya Hospital, a Boeing 777 commander based in Mumbai.",1
"Capt Prasad, 57, a Mumbai-based pilot and a commander on Boeing 777 aircraft, breathed his last at 1.30 am in Sion's K J Somaiya Hospital, according to a message sent to Air India pilots.",1
"According to a message circulated by Air India pilots, Capt Prasad, 57, passed away at 1.30 am in the K J Somaiya Hospital in Sion, Mumbai.",1
"Capt Prasad, 57, of Mumbai, a commander of Boeing 777 aircraft, passed away at 1.30 am at K.J. Somaiya Hospital, Sion, according to a message circulated among Air India pilots.",1
"Mumbai-based Capt Prasad, 57, a commander on Boeing 777 aircraft, died at 1.30 am in K J Somaiya Hospital, Sion, the Air India pilot group announced in a message.",1
"Capt Prasad, a 57-year-old Mumbai-based pilot who commanded Boeing 777 aircraft, died at 1.30am in K J Somaiya Hospital, Sion, according to a message circulated among members of the Air India pilots group.",1
"According to a message circulated among Air India pilots group, 57-year old Capt Prasad, a commander on Boeing 777 aircraft had died at 1.30 am in K J Somaiya Hospital, Sion.",1
"Captain Prasad, 57, of Mumbai, Japan, passed away at 1.30 am in a hospital in Sion, an Air India pilots message said.",1
"Capt Prasad, 57, fell to his death at 1.30 am in the K J Somaiya Hospital in Sion, according to a message circulated among Air India pilots.",1
"The firm had been using ""NewCo"" as a placeholder name in their contracts with external contractors, a source said.",1
"In their contracts with external contractors, the firm had already used ""NewCo"" as a placeholder name, according to the source.",1
"""NewCo"" had already been used in contracts with external contractors, the source said.",1
"A source said the firm already used the placeholder name ""NewCo"" as part of the contracts with external contractors.",1
"The source said ""NewCo"" was already used as a placeholder name in contracts with external contractors.",1
"The firm had already been calling the external contractors ""NewCo"" in their contracts, according to the source.",1
"NewCo' was already in their contracts with the external contractors as a placeholder, a source said.",1
"A source at the firm said ""NewCo"" was already being used as a placeholder name on the contracts with external contractors.",1
"Apparently, the firm had been using ""NewCo"" as a placeholder name in its contracts with external contractors.",1
"It had already been using “NewCo” as a placeholder name in contracts with external vendors, the source said.",1
"""I have brought Madurai AIIMS with me,"" DMK chief M K Stalin's son Udhayanidhi shouted, brandishing a brick atop his van.",1
"As he stood atop his van with a brick in hand, Udhayanidhi, the son of DMK chief M K Stalin, shouted, ""I am bringing Madurai AIIMS with me. "".",1
"Udhayanidhi, father of DMK chief M K Stalin, thundered from the top of his van, brandishing a brick, that he would take the AIIMS with him.",1
"DMK chief M K Stalin's son, Udhayanidhi, shouted from atop his van, ""I've brought Madurai AIIMS with me."" The battle cry went viral.",1
"In an audible battle cry that went viral, Udhayanidhi, DMK chief M K Stalin's son, stood atop his van, brandishing a brick.",1
"Udhayanidhi brandished a brick as he atop his van, proclaiming, ""I have brought Madurai AIIMS with me!"" A battle cry that quickly went viral.",1
"With a brick in hand, Udhayanidhi, the son of DMK chief M.K. Stalin, thundered, ""I have brought the AIIMS to Madurai with me,"" a battle cry that went viral.",1
"""I have brought Madurai AIIMS with me,"" Udhayanidhi, son of DMK chief M K Stalin, thundered from atop his van carrying a brick.",1
"As he stood atop his van with a brick in hand, DMK leader M K Stalin's son Udhayanidhi thundered, ""I am bringing Madurai AIIMS with me."" The cry went viral.",1
"While the battle lines grew sharper and the BJP's offensive got louder, the TMC chief campaigned in almost every seat.",1
"In the face of BJP's aggressive campaign, the TMC chief fought head on, campaigning in nearly every seat.",1
TMC chief Arvind Kejriwal campaigned in almost every seat as the battle lines increased and the BJP's offensive grew louder.,1
"With the battle-lines becoming clearer and the BJP's offensive becoming louder, the TMC chief campaigned in nearly every constituency.",1
"After the battle-lines sharpened and the BJP launched a louder offensive, TMC chief Modi campaigned in almost every constituency.",1
"Amid a hardening battle-line and BJP's louder attacks, the TMC chief campaigned in almost every seat.",1
"While the TMC chief campaigned in almost every constituency as the battle-lines grew more sharp and the BJP offensive became more loud, the TMC chief fought head-on.",1
"Almost all TMC candidates campaigned in all the seats, even as the battle lines were becoming more clear and the BJP's offensive became louder.",1
TMC chief Ishwar Chandrasekhar campaigned in virtually every constituency as the battle-lines became sharper and BJP's offensive increased in loudness.,1
"The TMC chief campaigned in almost all seats to meet the BJP's increased attacks, as the battle lines grew sharper and the BJP's offensive became more aggressive.",1
"The BJP-led North East Democratic Alliance of the small states in the region is led by the latter, a popular figure.",1
"Almost single-handedly, NDDI has built up the small states of the region under the leadership of the BJP.",1
They are both popular figures and the latter is almost solely responsible for the establishment of the BJP-led North East Democratic Alliance in the small states of the region.,1
The last man nearly single-handedly built the BJP-led North East Democratic Alliance comprising small states in the region.,1
"There is no doubt that these men are popular, particularly Alam, who almost singlehandedly built the BJP-led North East Democratic Alliance in the region's small states.",1
"There are two popular politicians, with the latter almost building the BJP's North Eastern Democratic Alliance from these small states.",1
"Almost single-handed, the latter built the BJP-led North East Democratic Alliance of small states in the region.",1
The latter nearly created the BJP-led North East Democratic Alliance of small states in the region.,1
"While the battle lines grew sharper and the BJP's offensive got louder, the TMC chief campaigned in almost every seat.",1
"In the face of BJP's aggressive campaign, the TMC chief fought head on, campaigning in nearly every seat.",1
TMC chief Arvind Kejriwal campaigned in almost every seat as the battle lines increased and the BJP's offensive grew louder.,1
"With the battle-lines becoming clearer and the BJP's offensive becoming louder, the TMC chief campaigned in nearly every constituency.",1
"After the battle-lines sharpened and the BJP launched a louder offensive, TMC chief Modi campaigned in almost every constituency.",1
"Amid a hardening battle-line and BJP's louder attacks, the TMC chief campaigned in almost every seat.",1
"While the TMC chief campaigned in almost every constituency as the battle-lines grew more sharp and the BJP offensive became more loud, the TMC chief fought head-on.",1
"Almost all TMC candidates campaigned in all the seats, even as the battle lines were becoming more clear and the BJP's offensive became louder.",1
TMC chief Ishwar Chandrasekhar campaigned in virtually every constituency as the battle-lines became sharper and BJP's offensive increased in loudness.,1
"The TMC chief campaigned in almost all seats to meet the BJP's increased attacks, as the battle lines grew sharper and the BJP's offensive became more aggressive.",1
"Both men are popular figures, with the latter nearly building the BJP-led North East Democratic Alliance of small states in the region by himself.",1
"The BJP-led North East Democratic Alliance of the small states in the region is led by the latter, a popular figure.",1
"Almost single-handedly, NDDI has built up the small states of the region under the leadership of the BJP.",1
They are both popular figures and the latter is almost solely responsible for the establishment of the BJP-led North East Democratic Alliance in the small states of the region.,1
The latter almost single-handedly built BJP's North East Democratic Alliance of small states in the region.,1
The last man nearly single-handedly built the BJP-led North East Democratic Alliance comprising small states in the region.,1
"There is no doubt that these men are popular, particularly Alam, who almost singlehandedly built the BJP-led North East Democratic Alliance in the region's small states.",1
"There are two popular politicians, with the latter almost building the BJP's North Eastern Democratic Alliance from these small states.",1
"Almost single-handed, the latter built the BJP-led North East Democratic Alliance of small states in the region.",1
The latter nearly created the BJP-led North East Democratic Alliance of small states in the region.,1
"Brian Lara is impressed with Rishabh Pant's improved off-side play, which he believes will add dimension to his game, making him a much more complete batsman in the future.",1
"Brian Lara, one of West Indies' greatest batsmen, is impressed with Rishabh Pant's improved off-side play, which he believes will make him a much more well-rounded batsman in the future.",1
"Rishabh Pant is impressing Brian Lara with his improved off-side play. Lara believes Pant's off-side play will enhance his game in days to come, making him a much more well-rounded player.",1
"Batting great Brian Lara has praised Rishabh Pant's much-improved off-side play, which he believes will make him a more well-rounded batsman going forward.",1
"The legendary West Indian batsman Brian Lara has been impressed with Rishabh Pant's extensive development off-side, which he believes will add depth to his game and make him a better all-around player over time.",1
"Lara believes Pant's much-improved off-side playing will add dimension to his game in the future, making him an even more well-rounded batsman.",1
"West Indies legend Brian Lara says Rishabh Pant's off-side play was much improved, and he believes it will make him a more well-rounded batsman in time to come.",1
"Former West Indies batting great Brian Lara says that Rishabh Pant has greatly improved his off-side play skills, which will make him a much more versatile batsman over time.",1
"Brian Lara, one of the most famous players from the West Indies, is pleased with Rishabh Pant's improvement around the off-side. Lara believes this will add new dimensions to Pant's game making him a much more well-rounded batting player in the future.",1
"In days to come, Brian Lara, the former West Indies batsman, believes that Rishabh Pant's improved off-side play will help round out his skills and make him a more-rounded batsman.",1
"Meanwhile, Dr Sahai stated that the department managed to control the surge of Covid-19 cases in Sangam city through intensive contact tracing.",1
"According to Dr Sahai, the department has managed to control the surge in Covid-19 cases in Sangam City by conducting intensive contact tracing exercises.",1
"In the meantime, Dr Sahai stated that the Sangam city department has managed to control the surge of Covid-19 cases with the help of intensive contact tracing (ICT).",1
"At the same time, Dr Sahai said the department managed to contain the surge of cases of Covid-19 in Sangam city through extensive contact tracing exercises (ICT).",1
Dr Sahai has claimed that the department has managed to contain the surge of Covid-19 cases in Sangam city thanks to intensive contact tracing (ICT) activities.,1
Dr Sahai stated that the department has been able to curb the rise of the Covid-19 virus in Sangam city via intensive contact tracing (ICT).,1
"The department, according to Dr Sahai, is managing to control the surge of Covid-19 cases in Sangam city by utilizing intensive contact tracing (ICT) exercise.",1
"The Department of Health has managed to contain the surge of Covid-19 cases in Sangam city through intensive contact tracing (ICT) exercise, Dr Sahai stated.",1
"Meanwhile, Dr Sahai claimed the department has managed to control the increase in Covid-19 cases in Sangam city by utilizing intensive contact tracing approaches (ICT).",1
"The mercury has been steadily rising over the past two to three days, and people have been feeling hot under the collar.",1
"Temperatures have steadily risen over the past two to three days, making people feel hot under the collar.",1
"For the past two to three days, the mercury has steadily risen with people feeling hot.",1
"There has been a steady increase in the mercury over the past two to three days, causing people to feel hot under the collar.",1
"It has been steadily rising for the past two or three days, and peoplehave felt hot under the collar.",1
"In the past couple of days, the mercury has been steadily rising with people feeling hot under the collar.",1
"There have been steady rises in temperatures over the past two to three days, with people feeling hot under the collar.",1
People have felt hot under the collar in the past two to three days as the mercury has been steadily rising.,1
Temperatures in the past two to three days have steadily risen andpeople have been feeling heat under their collars.,1
"For the past two to three days, the mercury has been rising steadily with people feeling hot under the collar.",1
"In the last few days, the Delhi government has intensified testing.",1
"In recent days, the Delhi government has ramped up testing.",1
"During the last few days, Delhi has significantly increased testing.",1
The Delhi government has substantially increased testing in recent days.,1
India's government has significantly ramped up testing over the last few days.,1
The Delhi government has intensified testing in the past few days.,1
"Recently, Delhi's government stepped up testing.",1
"In the last few days, the Delhi government has stepped up its testing.",1
India's government has increased testing substantially in the last few days.,1
Testing has significantly ramped up in Delhi in the recent days.,1
"Mohan Bhagwat, the chief of the Rashtriya Swayamsevak Sangh, has condoled the death of former President Pranab Mukherjee, saying that he leaves a void and will always be remembered.",1
"Mohan Bhagwat, chief of the Rashtriya Swayamsevak Sangh, saidformer President Pranab Mukherjee has left a void that will never be filled.",1
Rashtriya Swayamsevak Sangh chief Mohan Bhagwat said Tuesday thatformer President Pranab Mukherjee had left a void and would always be remembered.,1
"Mohan Bhagwat, head of the Rashtriya Swayamsevak Sangh, on Tuesday paid tribute to Pranab Mukherjee, saying the former president has left a void and will always be remembered.",1
"Rastra Swayamsevak Sangh chief Mohan Bhagwat has condoled the death of Pranab Mukherjee, saying that his death has left a void and he will always be remembered.",1
"Mohan Bhagwat, the chief of the Rashtriya Swayamsevak Sangh,expressed his condolences on Tuesday for the death of former President Pranab Mukherjee saying that the void left by his passing will forever remain.",1
"The Rashtriya Swayamsevak Sangh's Mohan Bhagwat issued a statement on Tuesday condoling the death of former President Pranab Mukherjee, saying that he will always be remembered.",1
"Rahath Swayamsevak Sangh chief Mohan Bhagwat has mourned the passing of ex-President Pranab Mukherjee, saying he has left a void and will be remembered forever.",1
"Rastra Swayamsevak Sangh chief Mohan Bhagwat on Tuesday condoleeed with the former President's family on his death, saying that the former President has left a void and will always be remembered.",1
"On Tuesday, Rashtriya Swayamsevak Sangh chief Mohan Bhagwat condoleeded the death of former President Pranab Mukherjee, saying that his death has left a void which will be felt forever.",1
"On the recovery front, a record number of patients were discharged,surpassing the number of new patients.",1
There were also more discharged patients than new cases on the recovery front.,1
"Recovery was also successful, as the number of discharged patientssurpassed the number of new cases.",1
"It was also a good day on the recovery front, with more patients beingdischarged than new patients.",1
"Additionally, the number of patients discharged outnumbered freshcases on the recovery front.",1
"There were more discharged patients than new patients, which was agood sign on the recovery front.",1
"The day was also very successful on the recovery front, with dischargesoutpacing fresh cases.",1
"In addition, the number of discharged patients surpassed the new caseson the day.",1
"Also, as a sign of recovery, more patients were discharged than wereadmitted.",1
"It was also a good day on the recovery front, as discharged patients exceeded fresh cases in number.",1
It should not be surprising that the six confirmed cases had come intocontact with many people before their infection status was confirmed.,1
"Due to the fact that the six confirmed cases had come into contact with many people before their infection status was determined, the community transmission should not come as a surprise.",1
A community transmission is not surprising given that the six confirmed cases were in contact with a wide range of people before they wereidentified as infected.,1
"Due to the fact that the six confirmed cases had many contacts beforethey were confirmed to be infected, community transmission should not have been a surprise.",1
Community transmission should not be a surprise since the six confirmed cases came in contact with many people before their infection status was confirmed.,1
Community transmission is not unexpected given that the six confirmed cases had been in contact with many people before their infection status was confirmed.,1
It should not be surprising that transmission occurred within the community given that the six confirmed cases had come into contact with many people before their infection status was determined.,1
The fact that the six confirmed cases had come into contact with many people before their infection status was recognized suggests that community transmission is not a surprise.,1
Community transmission probably isn't a surprise given that the six confirmed cases had come into contact with many people before beingconfirmed as infected.,1
"Due to the fact that the six confirmed cases had repeatedly come intocontact with many people before their infection status was determined, community transmission should not be taken as a surprise.",1
