The Integrated Disease Surveillance Program (IDSP) network of theHealth Ministry is tracing people who have come into contact with the six people whose samples have been sent for confirmation.,1
"In a bid to trace people who have had contact with the six people whose samples have been sent for confirmation, the Health Ministry's Integrated Disease Surveillance Program (IDSP) network has stepped up its efforts.",1
The Ministry of Health's Integrated Disease Surveillance Programme (IDSP) network is on the hunt for people who may have been in contact with the six people whose samples were sent to confirmation.,1
IDSP (Integrated Disease Surveillance Program) is working hard to trackdown people who have come into contact with the six people whose samples have been sent for confirmation.,1
"As part of the Integrated Disease Surveillance Program (IDSP), theHealth Ministry is tracking down people who may have come in contact with the six people whose samples have been sent for confirmation.",1
Health Ministry's Integrated Disease Surveillance Programme (IDSP) network is tracing individuals who came into contact with the six people whose samples have been sent for confirmation.,1
"Integrated Disease Surveillance Program (IDSP) network workers are onthe case, attempting to find those who have been in contact with the six individuals whose samples have been sent for confirmation.",1
IDSP (Integrated Disease Surveillance Program) of the Health Ministry ison the hunt to find the six people whose samples have been sent for confirmation.,1
Health Ministry's Integrated Disease Surveillance Program (IDSP) network is working hard to trace people who have come into contact with six people whose samples have been sent for confirmation.,1
"In pursuit of tracing people who have come into contact with the six people whose samples have been submitted for confirmation, the Health Ministry's Integrated Disease Surveillance Program (IDSP) network is busy tracking them down.",1
"Tedros praised China's response in a news conference in Geneva on Thursday evening, but said the WHO was announcing a global health emergency because it was concerned about the virus spreading to countries that did not have the resources to deal with it.",1
"At a news conference on Thursday evening in Geneva, Tedros praisedChina's response, but said the WHO had declared a global health emergency out of concern that the virus would spread to countries that lacked the resources to deal with it.",1
He said the WHO is declaring a global health emergency due to itsconcern about the virus spreading to countries that do not have the resources to combat it in a news conference in Geneva on Thursday evening.,1
"In a news conference in Geneva on Thursday evening, Tedros praised China's response, but said that the WHO declared a global health emergency because the virus could spread to countries without the resources to control it.",1
A WHO spokesperson said on Thursday evening that the WHO was declaring a global health emergency because it was concerned about the virus potentially spreading to countries that lacked the resources to contain it. Tedros praised China's response to the problem but said he was concerned about the virus spreading to countries lacking the resources to contain it.,1
"On Thursday evening, Mr. Tedros spoke at a news conference in Geneva to praise China's response, but said the WHO declared a global health emergency due to concern over the virus spreading to countries that did not have resources to deal with it.",1
"Tedros praised China's response at a press conference in Geneva on Thursday evening, but explained that the WHO had called for a global health emergency because it was concerned that the virus could spread to countries without the resources to deal with it.",1
"At a news conference in Geneva on Thursday evening, Tedros praisedChina's response, while he told reporters that the WHO had declared a global health emergency because it was concerned the virus mightspread to countries that lack the resources to deal with it.",1
"On Thursday evening, Tedros praised China for its response but said the WHO had declared a global health emergency out of concern about the virus spreading to countries without resources to cure it.",1
"In a news conference on Thursday evening in Geneva, Tedros praisedChina's response to the situation, but indicated that the WHO declared a global health emergency to deal with the virus when it was concerned that it could spread to countries without the resources to deal with it.",1
"""These gimmicks are not going to work in the elections as the writing ison the wall,"" the BJP leader said when asked about the demand to derecognize the BJP.",1
"A BJP leader called the demand for derecognising the BJP nothing but 'minority communalism' in the guise of so-called secularism, saying that""these gimmicks will not work in the elections as is clear from the literature.""",1
"The BJP leader dismissed the call for derecognition as little more than 'minority communalism' under the guise of supposed secularism, saying, ""This is not going to work in elections as the writing on the wall is very clear.""",1
"In his reaction to the demand to deregister the BJP, the BJP leaderstated that this was nothing but so-called minority communalismdisguised as secularism. ""These gimmicks aren't going to work in the elections,"" he added.",1
"As for the call to deny recognition to the BJP, the BJP leader referred to it as 'minority communalism' through the face of so-called secularism, saying, ""These gimmicks will not work in elections since the writing is clearly on the wall.""",1
"""These gimmicks"" are not going to work in the elections, the BJP leader said, describing calls to derecognize the BJP as ""minority communalismdisguised as secularism.""",1
"Defending the march towards derecognising the BJP as nothing but minority communalism in disguise of so-called secularism, the BJP leader declared, ""these gimmicks will not work in the elections as the writing on the wall is very clear.""",1
A BJP leader said these gimmicks will not work in the elections becausethe writing on the wall seems to indicate that disenfranchisement of theBJP is nothing but 'minority communalism' in the guise of 'secularism'.,1
"The BJP leader called the demand for derecognition nothing but 'minority communalism' hiding behind so-called secularism, explainingthat these gimmicks will not work in the elections as the writing is on the wall.",1
"In response to the demand to derecognize the BJP, BJP leader said, ""thewriting on the wall is very clear: these gimmicks are not going to work in the elections.""",1
"Mumbai is fast becoming a major center for drug trafficking, based onrecent seizures.",1
"According to the seizures in the last few weeks, Mumbai is rapidlybecoming a major drug trafficking center.",1
"In recent weeks, Mumbai has become a major hub for drug trafficking.",1
Mumbai is fast becoming one of the world's major drug trafficking centers if recent seizures are any indication.,1
Recent seizures in Mumbai suggest that the city is quickly becoming a major center for drug trafficking.,1
"If the recent drug seizures in Mumbai are any indication, this city is fastbecoming a major center for drug trafficking.",1
"In the last few weeks, there have been several large seizures in Mumbaithat show Mumbai is becoming a major trafficking hub.",1
"In light of the seizures over the last few weeks, Mumbai is becoming amajor center for drugs trafficking.",1
Recent seizures in Mumbai suggest the city is fast becoming a major center for drug trafficking.,1
"Based on the seizures in the last few weeks, Mumbai is fast becoming amajor drug trafficking hub.",1
"The Belgians, along with the rest of the hockey world, had a difficult yearafter becoming the new world champions.",1
"Belgium, along with the rest of the hockey world, had to endure a difficult time after a year as world champions.",1
Belgians as well as the rest of the hockey world endured a difficult timeafter being crowned world champions a year ago.,1
"After celebrating a year as new world champions, the Belgian team, along with the rest of the hockey world, had to go through a difficult time.",1
"Belgian hockey, along with the rest of the hockey world, experienced adifficult period following the year they became world champions.",1
"Having been crowned hockey world champions for a year, the Belgians, along with the rest of hockey, endured a difficult period.",1
"With the Belgians as the new world champions, the hockey world had to undergo a challenging period following the championship year.",1
"While the Belgians were the new world champions one year ago, the rest of the hockey world had to go through difficult times.",1
"Following a successful year as new world champions, Belgium and the rest of the hockey community had to face difficulties.",1
"With a year as world champions behind them, the Belgians, along with the rest of the hockey world, had one tough year.",1
"The Indian men's team was scheduled to tour the Netherlands for practice matches, but the proposal was shelved due to health concerns.",1
A proposal for an Indian men's team tour to the Netherlands wasshelved because of the health crisis on the recommendation of coaches and SAI officials.,1
"Due to the health crisis, the proposal was shelved after coaches and SAI officials recommended it.",1
"A tour of the Netherlands for practice matches was planned for the Indian men's team, but was pushed back by coaches and SAI officials due to a health crisis.",1
"After the health crisis, the Indian men's team's proposal to tour the Netherlands for practice matches was shelved.",1
"As a result of the health crisis, the coaches of the Indian men's teamrecommended shelving the proposal to tour the Netherlands for practicematches.",1
"Despite a scheduled trip to the Netherlands for practice matches by the Indian men's team, the proposal has been shelved on advice of coaches and SAI officials because of the health crisis.",1
"The Indian men's team was due to tour the Netherlands for practice matches, but due to a health crisis the plan was shelved.",1
"On recommendation of SAI officials and coaches, the proposal to tour the Netherlands for practice matches was shelved due to the health crisis.",1
The Indian men's team was scheduled to visit the Netherlands for practice matches but was shelved on the recommendation of coaches and SAI officials due to the health crisis.,1
"There is also a place for Rajeev Shukla and Pramod Tiwari in the CWC, but the surprise entry is Tariq Anwar, who has been made the CWC's general secretary.",1
"The CWC also has Rajeev Shukla and Pramod Tiwari on board, but Tariq Anwar is the surprise entry.",1
"In addition to Rajeev Shukla and Pramod Tiwari, Tariq Anwar has been appointed general secretary, a surprise to many.",1
"Raheev Shukla and Pramod Tiwari were also named to the CWC, but Tariq Anwar, who was appointed general secretary, is the real surprise.",1
"In addition to these two names, Tariq Anwar has also been named a member of the CWC.",1
"There are also Rajeev Shukla and Pramod Tiwari in the CWC, but the biggest surprise is Tariq Anwar, who was named general secretary.",1
"Besides Tariq Anwar, Rajeev Shukla, and Pramod Tiwari, there is alsoRajeev Shukla who has been appointed a member of the CWC.",1
"Rajeev Shukla and Pramod Tiwari also made it into the CWC, but the biggest surprise was Tariq Anwar, who became the CWC's top executive.",1
"Rajeev Shukla and Pramod Tiwari have also been tapped for the CWC, but Tariq Anwar is the surprise inclusion as secretary general.",1
"There's also Rajeev Shukla and Pramod Tiwari in the CWC, but it's Tariq Anwar who's made the CWC's general secretary.",1
The Ramesh claim that India's position vis-à-vis China was weakened byPM Modi's own comment.,1
Ramesh said PM Modi's own statement had weakened India's positionvis-à-vis China.,1
Ramesh claimed that Prime Minister Modi's own statement undermined India's position vis-à-vis China.,1
Ramesh alleged that PM Modi's own statements had weakened India's position vis-a-vis China.,1
"According to Ramesh, the PM's statement weakened India's position vis-à-vis China.",1
"According to Ramesh, PM Modi's own statement crippled India'sstanding with China.",1
The Indian government is perceived to be weakening its position vis-à-vis China as a result of PM Modi's own comments.,1
"During a televised interview with Ramesh, he alleged that PM Modi's own statement ""shrank"" India's position toward China.",1
RAMESH claimed that PM Modi's own statement weakened India'sposition against China.,1
Ramesh stated that PM Modi's own remarks had weakened India'sposition vis-à-vis China.,1
"Ahead of the Bihar state elections, the Centre appears to be piggybacking on PSU (public sector unit) schemes to project its development plank.",1
"To project its development plank ahead of the state elections in Bihar, the Centre appears to piggyback on PSU (public sector units) schemes.",1
It appears that the Centre is relying on public sector units (PSUs) to promote its development plank ahead of state polls in Bihar.,1
"Prior to state polls in Bihar, the Centre appears to be riding on PSU schemes to project its development plank.",1
Centre seems to be piggybacking on PSU (public sector units) schemes to project its development plank ahead of Bihar's state elections.,1
Bihar's upcoming state elections provide the Centre with an opportunityto push its development plank as it capitalizes on PSU (public sector unit) schemes.,1
The Centre seems to be piggybacking on PSUs to promote its development plans ahead of the state elections in Bihar.,1
"Prior to the state polls in Bihar, the Centre is seemingly riding on PSU (public sector unit) schemes to project its development plank.",1
Centre appears to be piggybacking on PSU (public sector units) schemes to frame its development plank in Bihar ahead of state elections.,1
The Centre is seemingly piggybacking on public sector unit schemes asit promotes its development plank ahead of Bihar's state elections.,1
"""When we lose wickets in the powerplay, it's gonna be tough, especially when we're only playing six batters. Getting Mayank run-out wasn't the best start,"" said a disappointed Rahul in the post-match presentation.",1
"Getting Mayank run-out didn't seem like the ideal start, especially withonly six batters,"" Rahul said in the post-match presentation.",1
"""It's gonna be tough when we lose wickets in the powerplay, especially when we're playing only six batters,"" said Rahul after the game. ""Mayank's run-out wasn't the ideal start; it was an absolute disaster.""",1
"When we lose wickets in the powerplay, it is going to be tough, especially if we are only playing six batters. Getting Mayank run-out was a disaster,"" Rahul said in the post-match presentation.",1
"When we lose wickets during the powerplay, it's tough, especially when we have only six batsmen. Getting Mayank run-out wasn't the ideal start; it was a catastrophe,"" Rahul said in his post-match presentation.",1
"Rahul lamented the fact that he lost wickets in the powerplay, especially when only six batters are available. ""Having Mayank run-out at the start wasn't an ideal start,"" he said in the post-match presentation.",1
"In the post-match presentation, a disappointed Rahul remarked, ""We lostwickets in the powerplay and Mayank's run-out wasn't the best start.Getting Mayank run-out was a disaster.""",1
"""When we lose wickets in the powerplay, it's going to be tough,"" Rahulsaid in the post-match presentation. ""Getting Mayank run-out wasn't the ideal start.""",1
"A loss of wickets in the powerplay means we will have a tough time, especially when we have only six batters on board. Getting Mayank run-out wasn't the best start, Rahul said afterwards.",1
"When we lose wickets early in the powerplay, it'll be tough, especially when we have only six batters. Getting Mayank run-out wasn't the beststart.",1
"Rahul praised his bowlers, saying: ""The last five games, we struggled with our death bowling. Today, they showed courage and pulled things back. You expect them to score more than 230 after that start.""",1
"""The last five games, we have struggled with our death bowling, but today was a positive. The boys showed courage and pulled things back. We expect them (SRH) to score 230+ after that start.""",1
"The SRH bowlers showed courage and pulled things back. With that start, you expect them to score more than 230. After that start, Rahul was full of praise for his bowlers.",1
"SRH captain Rahul said: ""We've struggled with our death bowling in thelast five games, but this game we were able to hold things back. You'dexpect them to score 230+ after that start.""",1
"Rahul praised his bowlers after the game: ""The last five games, we struggled with our death bowling, but that changed today. The boys showed a lot of guts and pulled themselves together after that start.""",1
"He praised the bowlers, saying, ""We struggled with death bowling for the past five games but that came good today. The boys showed courage and managed to catch up. It was expected that they would score 230 or more after that start.""",1
"Rahul praised his bowlers, saying, ""The last five games we failed to deal with our death bowling, but they were able to pull things back today. You would expect them (SRH) to score 230+ after that start.""",1
"Rahul praised his bowlers for their precision and courage, saying: ""We'vestruggled with our death bowling the last five games, but today, werecovered. You imagine them (SRH) to score 230-plus after that start.""",1
"Rahul praised his bowlers, saying: ""The last five games we struggled with our death bowling, but they pulled back today. After that start, you expect them (SRH) to score on top of 230.""",1
"Mahul praised his bowlers, saying: ""The last five games we struggled with our death bowling, but today, we pulled back. You should have expected them (SRH) to score more than 230 after that start.""",1
"The Indian cricketer, who made his Test debut against Australia in Bengaluru, was impressive, scoring 72 in the second innings of India's 207-run chase.",1
"During India's 207-run chase against Australia in Bengaluru, Pujarascored 72 in the second innings of his Test debut.",1
"Pujara scored 72 runs in India's successful 207-run chase in the secondinnings, on his Test debut against Australia in Bengaluru.",1
"Pujara had an impressive debut against Australia in Bengaluru, scoring72 runs in the second innings to help India post a successful 207-run chase.",1
He was the leading run scorer as India successfully chased 207 runs in their second innings against Australia in Bengaluru. Pujara made hisTest debut in Bengaluru and scored 72 in the second innings.,1
"Indian batsman Pujara, making his Test debut against Australia in Bengaluru, registered 72 runs in his first outing as he helped India chasedown 207 runs in the second innings.",1
"As part of India's successful 207-run chase in the second innings, Pujarahad a score of 72 during his Test debut against Australia in Bengaluru.",1
Pujara's 72 in India's successful 207-run chase in the second inningshelped him to a memorable debut against Australia in Bengaluru.,1
"During India's successful chase of 207 runs against Australia in Bengaluru, Pujara made 72 in the second innings to help India win theTest match.",1
The Indian test debutant had a superb outing as he scored 72 in the second innings of India's 207-run chase against Australia in Bengaluru.,1
"Pavan asked my son to return Rs 11 lakh, and later told me he was harassing him about it.",1
He later told me he was harassing Pavan over the return of Rs 11 lakh.,1
"Pavan was harassing my son over $115,000 he requested Pavan toreturn.",1
"In response to Pavan's request, my son told me that he was harassing him.",1
Pavan was harassed by my son for not returning Rs 11 lakh and later said to me he asked him to do that.,1
Pavan asked my son to return Rs 11 lakh and then told me he harassed him over it.,1