": A Madurai-based couple, who have walked around 800km across the state for the past 35 days spreading awareness messages on Covid-19, were felicitated by city-based ‘Ulaga Podhumarai Thirukkural Sevai Maiyyam’ at Perur Adheenam on Sunday.",0
The forum’s president C K Murugan said they honoured the couple with a certificate and a cash award.,0
"After walking from Madurai to Trichy and Viluppuram, they reached Coimbatore on Sunday, travelling through Salem, Erode and Avinashi, completing their on-foot trip.",0
"The couple, M Karuppiah, 50, and K Chitra, 52, said they started on August 24 and visited several villages, town panchayats and city corporations on their route while distributing pamphlets with information on Covid-19 and its precautions. “We prepared a pamphlet with information on Covid-19. We included information on symptoms, treatment, and prevention methods,” said Karuppiah.",0
The number of Covid positives in the state secretariat reached 59 on Monday when three employees were found corona positive.,0
"The employees were of the home, technical education and planning, economics & statistics departments.",0
A decline of over 20.5% has been recorded in the number of active cases in Uttar Pradesh in the past 10 days.,0
"Against 67,825 active cases on September 18, the number of active infections on Monday was 53,953 – a drop of 13,872 cases.",0
"“This is a positive sign and an outcome of a steady decline in the number of new cases along with an increase in the number of recovered persons,” said additional chief secretary, health and family welfare, Amit Mohan Prasad.",0
"The phase-2 human clinical trials of Covishield, developed by Oxford University, commenced in the state on Monday even as the health department invited volunteers to enroll and participate in the trials.",0
The safety and immunogenicity or the immune response of the vaccine candidate will be studied upon administering shots to healthy volunteers.,0
"Two centres in the city are among the 17 sites chosen for the trials initiated in the country by Serum Institute of India, which has an agreement with AstraZeneca that has collaborated with Oxford University.",0
A state health department official confirmed that volunteers were given shots of the vaccine candidate on Monday.,0
"However, officials did not reveal details on the number of volunteers who were administered the shots.",0
The state health department started calling for volunteers on September 9 through social media.,0
"A 42-year-old man, undergoing treatment for Covid-19, committed suicide by jumping from the fourth floor of the Government Medical College and Hospital (GMCH) on Sunday morning.",0
"According to the GMCH officials, the man had tested positive for the contagion and was undergoing treatment at the super-specialty building, where Covid-19 positive patients with comorbidities and critically ill patients are being treated.",0
"Begumpura police inspector Sachin Sanap, “We have registered a case of accidental death and have performed inquest panchanama. Statements are being recorded to ascertain facts in this case.”",0
"During the preliminary probe, it was found that the man plunged to death from the window of ward number 34 — on the fourth floor of the building.",0
"He was admitted to GMCH on September 21. However, after his condition deteriorated, he was shifted to ICU on September 25.",0
This is evident from the number of prosecutions.,0
"While around 25,000 individuals were fined for not wearing masks, violating social distancing norms and spitting in public from mid-June to September 17, in the past one week since enforcement was intensified, not only did officials fine 23,922 people from September 20 to 27, but also lodged FIRs in five cases on September 27.",0
Serum Institute of India will produce up to an additional 100 million COVID-19 vaccine doses for India and low and middle-income countries in 2021.,0
"The company made this announcement taking forward the collaboration between SII, Gavi, Vaccine Alliance and Bill & Melinda Gates Foundation.",0
The expansion follows August's announcement of up to 100 million doses to be delivered by the collaboration and bringing the total now to be delivered to up to 200 million doses of vaccines.,0
"Serum Institute, the world’s largest vaccine producer, will manufacture an additional 100 million doses of Covid-19 vaccines, on the back of a further $150 million at-risk funding under its collaboration with Gavi (Global Alliance for Vaccines and Immunisation) and the Gates Foundation, reports Rupali Mukherjee.",0
"This takes the total to up to 200 million doses to be rolled out by 2021, under the partnership, of which “at least half or 100 million doses are committed to India”, sources told TOI.",0
"The vaccine is expected to be priced around Rs 225-250 per dose for low- and middle-income countries (LMICs), including India.",0
"Concerned by the rise of Covid-19 cases in jails, Director General of Prisons, Anand Kumar has directed all superintendents of police and district magistrates to ensure aggressive testing, isolation and contact tracing and moving inmates lodged in temporary jails to main jails only after following prescribed protocol.",0
"In some cases, prisoners were shifted from temporary to main jail without following protocol because of which infection spread in main jails, Kumar said.",0
"The lapse defeated the purpose of temporary jails acting as a buffer to prevent infection from spreading, resulting in increase in cases in main jails, the DG added.",0
"With more than 1.6 lakh tests undertaken in the past 24 hours, the total number of Covid-19 tests conducted in the state reached 99.37 lakh on Tuesday.",0
"With an average of about 1.5 lakh tests in a day, UP is poised to cross the one crore mark on Wednesdy, health officials said.",0
"“UP government’s commitment to testing has helped in keeping the count of cases and deaths lower than many other states,” said additional chief secretary, health, Amit Mohan Prasad.",0
He added that seven new level two Covid-19 care facilities will get operational over the week.,0
"So far, the government has granted permission against three accused for Rs 173 crore worth properties.",0
"However, ACB is yet to get permission from the government to attach properties of former IMS director Devika Rani.",0
"Nagpur University has planned to start final year examinations with BA course from October 1, while engineering and other faculties papers would commence from October 5.",0
"The decision was taken in view of large number of subjects in arts faculty which would continue till October 18, the last day of exams.",0
We have decided to conduct papers where students strength is less.,0
"Therefore, some subjects in BA such as statistics are scheduled from October 1.",0
"We would also come to know the kind of problems we would be facing, Board of Examinations and Evaluation (BOEE) director Prafulla Sable told TOI.",0
"Since this will be the first time both examining body and examinees are undergoing online multiple choice questions (MCQ) paper in NU for regular courses, the administration is treading cautiously.",0
"We have kept papers of subjects where over 5,000 students would appear, in later phase from October 5, so we are in a better position to tackle problems, the director said.",0
"On Thursday, NU has scheduled online meetings for all its BOS and moderation committee members for familiarising them with software.",0
The participants would be trained on how to upload their questions directly into software and give options for answers.,0
"Moreover, they will also be taught on how to upload questions on mathematics equations, accounts and other subjects.",0
"They can log in only through their verified mobile numbers and OTP, Sable said, adding that entire data would be in encrypted form and nobody can read it.",0
The state governments decision to change the colour of school uniform has sparked a political debate.,0
The move is likely to put financial burden on parents of 77 lakh students as they have to buy new uniform.,0
"At a time when government school students are worried about missing classes because of lack of infrastructure for online education, even a discussion on the colour of uniforms is untimely and inappropriate.",0
"The government must rather focus on strengthening infrastructure, enhancing the quality of education and improving the literacy rate of girls, which is the worst-ever in the country as per the recent NSO report.Meanwhile, former education minister Vasudev Devnani alleged that the Congress government is politicizing education.",0
"Last time, uniform was changed in 2017 during the time of Vasundhara Rajes BJP government.",0
"It was done after 40 years in the state, but the Khaki colour of the uniform raised objections from opposition for implementing RSS pattern in education.",0
"When the uniforms colour was changed only three years back, what is the point of changing it again.",0
Parents have to purchase their wards uniform at the time when most of the parents are already suffering from economic losses in pandemic.,0
"School education expert K B Kothari said that politicizing the education is different but if the government wants to change the uniforms, they must do to rationally and scientific approach.",0
A committee should be formed for deciding the uniforms looking at the climatic condition of the state.,0
"Opinions of parents and teachers must also be taken into consideration, said Kotahri.",0
"Vipin Sharma, vice-president, Rajasthan Primary and Secondary Teachers Union said that government must provide the uniforms to students.",0
"If government provides for uniforms then it will be helpful for the parents, said Sharma.",0
"Last year, Congress government changed the colours of the bicycle distributed amongst students from orange to black.",0
Cycles were distributed in orange colour by BJP government which was changed.,0
"Rajasthan has third highest rate of unemployment in the country after Haryana and Tripura in August, according to CMIE data.",0
"Rajasthan, Goa, Himachal Pradesh and Uttarakhand which have high unemployment rates are all dependent on tourism and hospitality.",0
"Unless the tourism sector recovers, large-scale job creation will not take place, said N K Jain, president of Employers Association of Rajasthan.",0
They attribute to partly to the general slowdown in the country which was aggravated by the states own problems.,0
"After tourism, real estate has a big impact on job creation and the sectors underperformance contributed to the joblessness in a major way.",0
"Digvijay Dhabriya, which employs about 600 people in his PVC and UPVC manufacturing unit, said, If the real estate industry does not do well, it will have a huge bearing on a host of other industries.",0
"However, labour secretary Neeraj K Pawan, said that the figures indicate that the unemployment rate has not declined during the lockdown.",0
"Dhabriya said that after the new Congress government came to power, it got saddled with its own problems and there was much less scope to tide over the general slowdown the country was undergoing.",0
It is the first tranche of a $1 billion loan approved by ADB for the 82-km railway network.,0
"The signatories to the loan agreement were Sameer Kumar Khare, additional secretary (Fund Bank and ADB) at the Department of Economic Affairs in the Ministry of Finance and Kenichi Yokoyama, country director of ADBs India Resident Mission.",0
The RRTS which will reduce travel time between Delhi and Meerut to mere 50-minute is set to be operational by 2025.,0
The corridor has 24 stations including two depots at Duhai and Modipuram.,0
"The corridor will originate from Sarai Kale Khan in Delhi, and Modipuram in Meerut will be the last stop.",0
"In the first phase, the Meerut-Ghaziabad-Delhi corridor will be completed with a cost of Rs 30,274 crore by 2025.",0
"NCRTC, the implementing agency of RRTS, is a joint venture of the Centre (50%) and state governments of Haryana (12.5%), NCT Delhi (12.5%), Uttar Pradesh (12.5%) and Rajasthan (12.5%).",0
"Spokesperson of NCRTC, Sudhir Sharma, said, The proceeds of this tranche of US $500 million (Rs 3,750 crore) loan will be used for financing civil works, tracks, station buildings, multi-modal hubs, maintenance depots, and traction and power supply of the Delhi-Ghaziabad-Meerut RRTS Corridor.The RRTS is first of the three prioritized corridors planned for implementation in the country.",0
The other two are Delhi-Gurugram-Alwar and Delhi-Panipat.,0
Cases of power theft were registered against all the erring households.,0
Officials found 65 households were stealing electricity directly from the power line while 18 households were found using power after their connection was disconnected for for not paying electricity bills.,0
As many as 83 households were booked for stealing electricity from the main power line.,0
Further action is being taken.,0
"""The power department is also facing 40% line loss in city areas like Rampuram, Khalapar, Shamli stand, Numaish camp and Minakshi Chowk, said IP Singh, city SDO.",0
"Yatender Kumar, sub-divisional officer (SDO) of Bhopa power station, said, ""Bhokaredi village is listed as most line loss area"".",0
"Train No.06587 Yeshwantpur“Bikaner Bi-Weekly Special Express"" will depart Yeshwantpur at 05:00 hrs on every Sunday and Friday from September 13 till further advise, and it arrives at Bikaner at 06:50 hrs on Tuesday and Sunday.",0
"In the return direction, train No.06588 Bikaner“Yeshwantpur Bi-Weekly Special Express"" will depart Bikaner at 22:15 hrs on every Tuesday and Sunday from September 15 till further advise, and arrive at Yeshwantpur at 03:15 hrs on Friday and Wednesday.",0
Train No.06535 Mysuru“Solapur Daily Special Express will depart Mysuru at 15:45 hrs daily from September 12 till further advise and arrive at Solapur at 12:40 hrs on the next day.,0
"They also competed well against top sides such as Belgium, Netherlands and Australia in the FIH Pro League earlier this year.",0
"""We have certainly worked hard to record good wins in the recent past, however, we wouldn't have been able to raise our game without the world-class facilities and stadiums provided to us by Hockey India and Sports Authority of India.Practicing on a good turf with all the necessary facilities has helped us hone our techniques and become much better players and as a result, we have performed well consistently in the last few years,"" Akashdeeep Singh said in an official Hockey India release.",0
"""We have had some young talents such as Rajkumar Pal and Vivek Sagar Prasad join our team in the last few years.Our team has a great balance of experienced players and new talents, which is the perfect blend for being successful in competitions.I would certainly like to give a lot of credit to Hockey India for the way they have spotted talent through domestic competitions and nurtured them further so that they are in a position to perform for their country,"" said the 25-year-old.",0
The next goal on that road for the Belgians is to turn their 2016 Olympic silver to gold in Tokyo next year.,0
"Finally in September, as the world reached a stage where it had learned, to an extent, how to live with the coronavirus, international hockey returned, when Germany hosted Belgium in Dusseldorf for a two-match Pro League tie.",0
"To know how it felt and what changed, Timesofindia.com got in touch with the coach of the Red Lions, Shane McLeod, for an exclusive interview.",0
We also create the expectation of a new normal for the group.,0
Athletes need to have targets to look forward to and there is no better way to do this than playing other nations.,0
How many days before the matches against Germany did you get together as a group?,0
This means that the need to bring the group together before playing a match does not need to be for a long period.,0
"We travelled the morning before we played, as it is only a two-hour distance from where we train.",0
What do you prefer as a coach?,0
"In normal circumstances, we would travel a week to ten days before a tournament so that we get used to the time zone, conditions and climate; but for the Pro League, this is not practical.",0
"When we do travel and are in camp, it is a great way to bring the group to another level, playing-wise, and also as a team.",0
"#FIHProLeague #HockeyInvites #GERvBEL @BELRedLions' Loïck Luypaert reflects on the important learnings from the International Hockey Federation (@FIH_Hockey) Talking about the lockdown period in one of your earlier comments, you said, the ""players' technical levels are very high...and some even made gains"".",0
"For example, training to receive overheads was an easy topic to develop.",0
Players would do hundreds of repeatable exercises rather than 10 or 20.,0
This means that players' skill levels improved.,0
We are starting to shape a group ready to prepare for the next Olympic cycle.,0
We had two new players playing (for) their first caps for the Red Lions against Germany.,0
"Talking about the Covid-19 protocols related to match-days, what struck you the most when you stepped on the pitch?For me, a big part of the experience is the crowd.",0
"Without a crowd, it is very hard to not get the feeling of it being a training match.",0
It just shows that we are social creatures.,0
You won the first game against Germany comprehensively but then were held to a 1-1 draw in the second.,0
What changed?I think that playing two games back to back is an interesting experience.,0
"Firstly, when you win a game 6-1, you often struggle to look at the game in the same detail as you do if you are the team that loses.",0
You are now on the road to the Olympics.,0
How do you plan to do even better in Tokyo than you did in Rio in 2016?We still have many stages to pass through to have our Olympic readiness.,0
"In each game, we will focus on improvements and by the time the Olympics begin, you will see a very strong Belgium side ready to take on some of the world's best teams.",0
We cannot wait.,0
"Instead, the SAI has now given the go ahead to extend the camps, which were scheduled to end on September 30.",0
"The camp for the men's team has now been extended for a month till November 28, while the women's camp will continue till December 12.",0
"""The hockey camps for both the teams have been extended.The men's team camp has been extended till September 28 while the women's camp will be till December 12,"" a SAI official told PTI.",0
"""The men's team wanted to tour the Netherlands for a few practice matches but the idea was put off on the recommendation of health experts and chief coaches because of the risk associated with travelling.So, the SAI in consultation with Hockey India has decided to extend the camps.""The ongoing national camps resumed on August 19 after a month's break.",0
"The six hockey players who contracted COVID-19 last month have integrated with the rest of their teammates and are close to reaching peak fitness, men's national team head coach Graham Reid said on Saturday.",0
"Captain Manpreet Singh, Surender Kumar, Jaskaran Singh, Varun Kumar, Krishan Bahadur Pathak and Mandeep Singh were discharged from a Bangalore hospital on August 17 and were kept on quarantine for some more days before joining the team.",0
They started 2-3 weeks after others had started.,0
The Australian said he is hoping all the players would have full training in the next 4-5 weeks.,0
"""We are having our basic things, internal matches and will get to full training hopefully in 4-5 weeks.But international matches seem to be distant.""",0
The national camp for both men and women's teams resumed on August 19 at the Sports Authority of India Centre in Bengaluru.,0
"""You have to be patient, you cannot achieve full fitness quickly.It takes long time.You need to come out of this without injury,"" he said.",0
"""A lot of hamstring injuries are happening in football leagues like Bundesliga, EPL.If you start too fast you are risking injuries and you may be out for, say, six months.So, don't underestimate these lost months.""",0
"""The first two weeks of basic training helped us.We are are in good shape now,"" Sreejesh said.",0
"""It was initially very difficult to adjust to the situation but when we came back after the break, everybody started adjusting and getting used to it.Every player knows it.We know what will keep us fit with the ultimate aim being the Olympics.""",0
Indian hockey team forward Lalit Upadhyay was all-praise for the Belgian attack that imposed a massive 6-1 win against Germany in the FIH Hockey Pro League match on Tuesday.,0
The League resumed after a six-month hiatus due to the Covid-19 pandemic.,0
"""All of us had been looking forward for the FIH Hockey Pro League matches to start.Although we were hoping for a close game, it turned out to be quite one-sided.The German side struggled against their opponent's attack and Belgium's success inside the circle was very impressive,"" Upadhyay, who is part of the on-going National Coaching Camp in SAI, Bengaluru, said in a Hockey India release.",0
"""All six goals for Belgium came from six different goal-scorers.There is a lot to pick up from and analyse from this match.The loopholes in Germany's defence are also something we can learn from as to what not to do against a team like Belgium,"" stated Upadhyay.",0
"""We were able to resume activities because of the early measures taken by Hockey India who ensured a Hockey SOP was in place as early as April.
We were all briefed on guidelines to follow once the National Camp would begin so in that sense, resuming activities was smooth.Something that Germany seemed to struggle yesterday was with their speed and fitness so when we get back to competitive hockey that should not be the case with us,"" he said.",0
"""We know Hockey India and the coaching staff have put together a plan for us to resume competitive hockey.We are hopeful that we can hit good form before that. Our intensity in National Camp will increase October onwards and we are moving in the right direction and are prepared for any scenarios,"" Upadhyay said.",0
"Mandeep is one of the six hockey players of India's senior men's team, including skipper Manpreet Singh, who had tested positive for Covid-19 at the team's training base here last month after they arrived for the national camp.",0
"In fact, Mandeep was the first player to be admitted in the hospital here.",0
"Since then, all the six players have recovered and started their individual training sessions.",0
"""Although I have been in some of the most difficult match-situations as a professional hockey player, I had never felt this stressed,"" Mandeep said in a Hockey India release.",0
"""I was never (before) taken away in an ambulance, never been seriously injured either.So this phase was a new experience for me.After recovering, they (Hockey India) even gave us an option to return home to take a break if we felt like it, but we wanted to stay back and rejoin the rest of the group,"" said the forward, who scored maximum goals for India in 2019 season.",0
"""We have a very good trainer in Robin Arkel and he knows exactly how much to push us.We are taking only 50-60 per cent of the regular workload at the moment and have just one session per day,"" Mandeep said.",0
"""I believe our improved performance has a lot to do with the professional system laid out by the Federation.We have a good junior program too which identifies talented players,"" Rani said.",0
"""Young talent like Lalremsiami and Salima Tete who won the silver medal at the Youth Olympic Games 2018 in Buenos Aires have made a very smooth transition into the senior program.""",0
"""Ensuring we (women's team) also play equal or more number of international tournaments as the men's team gives us right exposure that adds to the confidence of these youngsters,"" she added.",0
"""Our team has done well against top sides in the recent past and therefore we are confident that we can win a medal for India at the Olympics.We just have to focus on our processes and then the desired results will follow.All our bases are covered and we are determined to make history in Tokyo.It's about going on the pitch with belief and we will be able to achieve anything,"" said Akashdeep.",0
"The 85-year-old is not responding to treatment and his platelet count has dropped further in the last 24 hours, a doctor at the facility said.",0
"“There is a deterioration in his neurological condition and he has very little consciousness. He is not responding to treatment. His condition is very critical,” a senior doctor at the hospital told PTI.",0
"Asked whether the actor has gone into a coma, the doctor said the medical practitioners are “evaluating the patient’s current condition”.",0
"The octogenarian’s COVID-19 encephalopathy has also deteriorated, he said.",0
Encephalopathy is a general term to describe a disease that affects the function or structure of the brain.,0
The actor’s age and comorbidities are a matter of concern for the doctors.,0
"“His organs like lungs and heart are working well and his blood pressure is normal but his consciousness is a cause of concern,” he said.",0
The actor was admitted to the hospital on October 6 after he tested positive for COVID-19.,0
Chatterjee had tested negative for the infection last week after which he was shifted to a non-COVID ITU.,0
"“Vice President Pence and Mrs. Pence both tested negative for COVID-19 today, and remain in good health,” said Devin O’Malley, adding that Mr. Pence would maintain his schedule “in accordance with the CDC guidelines for essential personnel.”",0
