"Though the BJP leadership has been reportedly mulling finding a suitable successor to Yediyurappa keeping the 2023 assembly polls in mind, party insiders said it has not been able to execute its plans because of various factors, including Union home minister Amit Shah’s unavailability.",0
The political predicament also appears to be taking a toll on Yediyurappa and governance as he hasn’t been able to expand the cabinet.,0
The CM had planned to meet the duo when he completed one year in office but to no avail.,0
"He’s now scheduled to visit New Delhi on Thursday, where he is expected to meet Union ministers regarding flood relief, development projects related to states and GST compensation, official sources said.",0
"“If he fails to do so, he would face open rebellion from senior MLAs who are unhappy with the delay and it would lead to another round of political crisis,” said a senior minister.",0
"“Further delay is likely. Despite threats from new legislators and our own party functionaries, the CM is unable to expand his cabinet without the central leadership’s assent,” added another functionary.",0
"“The party should make a concerted effort to infuse fresh blood in the state-level party organisation and not just play a game of musical chairs of shuffling people across positions. Those with grassroots support need to be inducted to galvanise the party,” said Sandeep Shastri, a political analyst.",0
"Taking serious note of allegations pertaining to irregularities in gravel extraction in the district, the government has ordered a probe.",0
Panchayat raj and mining minister Pedireddy Ramachandra Reddy took the decision after receiving complaints from party legislators in the district and asked district collector Samuel Anand Kumar and mines & geology department director Venkata Reddy to conduct a probe into the issue and submit a report.,0
Sources said the party legislator reportedly submitted a detailed report with evidence which prompted the minister to order the inquiry.,0
The legislator is his report said that large quantities of gravel had been excavated from his constituency without requisite permits and sold to private realtors.,0
The legislator claimed that the gravel was extracted on the pretext of land-levelling work for the house site project under Nava Rathnalu scheme.,0
"“The Mandal Parishad Development Officers (MPDOs) of at least 6-7 mandals in the district were involved in the scandal as the gravel was taken away from different quarries disproportionate to the permits issued by the mines department,” the legislator said.",0
He submitted also certain documents to substantiate his point on the illegal mining activity.,0
"“The MPDOs requisitioned for supply of about 83,755 cubic meters of gravel for levelling... However, about 1,62,855 cubic meters of gravel was lifted from one mandal which means that nearly 79,000 cubic meters of gravel was sold out illegally,” the legislator said in his letter to the minister.",0
He said that massive illegal mining had not only caused serious damage to the ecology but also caused irreparable loss to the exchequer.,0
The legislator said that field level officials had taken advantage of chief minister YS Jaganmohan Reddy’s programme to distribute house-sites among the poor to make money.,0
"Curiously, an MPDO, who is suspected to have played key role in the irregularities, went on long-leave, soon after the minister ordered a probe into the scandal.",0
The Indian government has set up an inquiry into the revelations that a Chinese company is spying on Indian citizens including the top political class and officials across the board.,0
The issue was raised in the ongoing Parliamentary session by Congress MP KC Venugopal on Wednesday.,0
"Foreign minister S Jaishankar, in a letter to Venugopal, said that China had denied any links with the private company while the company Shenzhen Zhenhua had also said that the data collected was from open sources and was no different from what was done by western companies.",0
It had denied accessing private information about the individuals from confidential sources.,0
Jaishankar said the MEA took up the matter with the Chinese ambassador on Wednesday while the Indian embassy in Beijing also broached the subject with the foreign ministry of China.,0
"“The Government of India takes very seriously the protection of the privacy and personal data of Indian citizens. It is deeply concerned at any report that suggests that foreign sources are accessing or seeking to access the personal data of our citizens without their consent. The Government has constituted an Expert Committee under the National Cyber Security Coordinator to study these reports, evaluate their implications, assess any violations of law and submit its recommendations within thirty days,” the minister wrote.",0
"Congress sought compensation for the families of migrant workers who died while walking to their native places with party's deputy leader in the House, Anand Sharma, pointing out that images of deprivation that went out from India cannot be denied even as he said that medical professionals and other frontline workers faced a steep learning curve.",0
"Pro-Congress voices were wondering if a special lift would have to be made to accommodate the leader's car so he could visit his office in Mantralaya, he said, pointing out that the main opposition was an alliance partner in the state government.",0
Trinamool's Derek O'Brien said the Centre should be humble in dealing with the states and pointed to West Bengal chief minister Mamata Banerjee drawing social distancing circles in public spaces.,0
"Starting the debate, Sharma also sought to know from the government why there was no figure for the number of migrants who died.",0
"""There should be a register and those people who live in cities who did not get food security, ration, please find solution for such exigencies,"" Sharma said.",0
The debate will resume on Thursday when health minister Harsh Vardhan will reply.,0
"Accusing the Centre of not consulting experts to draw a strategy to deal with the pandemic, O' Brien said out of every Rs 100 spent on public health, Rs 63 comes from the states and only Rs 37 from the central government.",0
"""The problem is when things are going good, you want to take the credit. When things are tough, you start talking about chief ministers,"" he said, adding that the PM Cares Fund was the most ""opaque"" fund in the world.",0
"RCP Singh of JD(U) said during the pandemic, workers from Bihar, who contributed to the development of other states as migrant labour, were ""deserted"".",0
"There are over 20 lakh migrants workers from Bihar who were sent back without recognising their contribution and now they are being called back by their respective employers, he said.",0
"Swapan Dasgupta, a pro-BJP nominated member, said there was an element of confusion over the total number of Covid-19 cases.",0
"""We agree that there is a huge number of people that has been infected. The story which goes throughout the world is that somehow our figure is understated,"" he said.",0
"""Now, I do not know whether that is true or false but a lot of mathematical modelling on which they are based on would suggest that actually in India the tally would go up to 70 to 80 crore, which seems an absurd proposition,"" he added.",0
Tiruchi Siva (DMK) alleged late action by the government in initiating steps to tackle Covid-19 and said this delay has led to the present situation.,0
"""The first case was detected in January and the self-imposed curfew started from March 23,"" he said. He alleged that the government was ""under-reporting"" cases.",0
"Three months after passing an amendment to sanction a new political map that identifies Indian territory in Uttarakhand’s Pithoragarh as its own, Nepal has inscribed the changes in its academic curriculum and currency.",0
"The office of Nepal education minister Giriraj Mani Pokharel confirmed to TOI the book, ‘Nepalko Bhubhaag Ra Seemasambandhi Swadhyay Samagri (Nepal’s geography and territorial boundary)’ has been introduced for higher secondary school students.",0
The book includes the disputed area of Kalapani in Uttarakhand as Nepal’s territory.,0
"The same day, the Nepal cabinet, headed by PM K P Oli, also gave permission to the country’s central bank, Nepal Rastra Bank, to mint new coins of one-rupee and two-rupee denominations with the new political map.",0
"In November last year, Nepal had protested against the inauguration of a key Lipulekh road in Pithoragarh by Union defence minister Rajnath Singh, alleging that a part of the stretch passed through Nepal’s territory.",0
"After a renewed dispute over three areas — Limpiyadhura, Lipulekh and Kalapani — Nepal’s parliament unanimously voted to amend the Constitution to update the country’s map to include them as part of its land.",0
The government had then announced that all documents will start using the new map.,0
"So now, a source said, introduction of the map in school books and coins is “fully legal” because it follows what is a regular course of action.",0
"“The government has started the process of issuing the new maps to Nepal embassies and is introducing it in government gazettes as well,” the source added.",0
"“There have been misunderstandings between the two nations over the past few months. However, introducing a new Nepal map is a sovereign decision by the country,” Khadga KC, head of the department of international relations and diplomacy at Tribhuvan University, told TOI.",0
“But I do believe that the issues should be resolved through dialogue and a solution must be found.”,0
"A day after BJP’s oldest ally Shiromani Akali Dal pulled out of the Modi government to protest against the legislations meant to restructure agricultural trade, and amid continuing opposition from Congress and some other parties, PM Narendra Modi went on the offensive on Friday and called the bills a “historic” pro-farmer measure and dismissed the resistance as having been engineered by “middlemen”.",0
He also assured farmers procurement of their produce under the minimum support price (MSP) regime would continue.,0
"“Yesterday was a historic day for the country in the field of agricultural reforms. The agricultural reform bills have been passed which has liberated our farmers from many restrictions,” Modi said while addressing a virtual meeting after launching railway projects for poll-bound Bihar.",0
"“Middlemen used to take a major part of farmers’ profits. The bill will prove to be protective cover for farmers,” he added.",0
His remarks came after he forwarded the resignation of Akali Dal’s Harsimrat Kaur Badal as minister for food processing and amid Congress’s effort to step up its opposition to the troika of bills meant to reform trade in farm produce.,0
"Congress called protests against the bills a “Mahabharata” for farmers and dubbed the Modi government as the “Kauravas”. It also sought to enlist allies by appealing to BJP’s coalition partners in Bihar and Haryana, JD(U) and JJP respectively, as well as regional formations YSRCP, TRS and AIADMK.",0
"“This is Mahabharat in which BJP is in the role of Kauravas who are anti-farmer and facing them are Pandavas in the form of farmers and farm labourers. Congress is with the Pandavas. Now, all the BJP allies who are enjoying power will have to decide if they stand with farmers or with Kauravas,” party spokesperson R S Surjewala said.",0
"Punjab CM Amarinder Singh claimed the legislations would lead to growing angst among people in the border state, “thus giving Pakistan the opportunity to stoke more fires”.",0
He added that Delhi must rethink its “anti-farmer” move as it would undo the sacrifices made by Punjab and its farmers over the last 65 years to make India self-sufficient in food.,0
Harsimrat Badal justified her walkout and claimed that BJP had disregarded SAD's demand for sounding out allies on the farm bills.,0
"“I kept on protesting ever since these ordinances were circulated for comments in the cabinet. I was acting like a bridge between farmers and the government to clear all doubts and fears of farmers. I kept on pleading that the government should not bring these bills until all apprehensions and fears of farmers are cleared,” she said.",0
"“I feel very saddened about the fact that my voice was not heard in the cabinet and the government did not send it to a parliamentary select committee for consultations with all stakeholders, including farmers. If my voice had been heard, farmers would not have come out on roads to protest,” she added.",0
"“Two bills related to farmers were passed by Parliament yesterday without removing their doubts. BSP does not approve of this. What does the farmer of the country want? It would be better if the central government pays attention in this regard,” she tweeted.",0
"“There are parties, who ruled the country for decades, who are trying to misguide farmers. These parties had made electoral promises, these reforms were part of their manifesto but when the NDA has done it, they are opposing it,” the PM said, referring to Congress.",0
Modi asked farmers to beware of the lies being spread on behalf of middlemen.,0
"BJP got assistance from its Haryana ally JJP which, defying the widely held expectation, refused to join the Akalis in opposing the three legislations.",0
"The party's stand, announced by its leader Ajay Chautala, is significant because the Haryana outfit, just like the Akalis, draws its political sustenance from farmers.",0-Pure
"Other BJP leaders, including party chief J P Nadda and home minister Amit Shah, remained on the offensive, standing by the legislations and attacking Congress.",0
"Yet, aggressive protests in the capital’s neighbourhood would be bad optics for the government, especially at a time when it is grappling with the triple challenges of Covid-19, China's aggression on the border and a contracting economy.",0
"Niti Aayog CEO Amitabh Kant said the government was pushing for electric motilities with FAME and FAME 2 schemes, bringing down the rate of taxes on electric vehicles at 5%, as compared to 28% for other vehicles and 43% for hybrid vehicles.",0
"“We also give tax exemption, up to Rs 1 lakh, to people who are buying electric vehicles. As a consequence of all this, the focus on electrification will be huge and if India has to emerge as a leader in clean, connected and shared mobility, there are two important things to keep in mind — one is that India is a major user of two- and three-wheelers and 80% of people travel in these vehicles. Second, battery will be an important component. Battery manufacturing and storage will be a key component and storage will have to be linked to renewable energy integration with the grid,” he said in an interactive session for students of the first batch of MS (Research) in e-mobility programme, organised by IIT-Guwahati on Saturday.",0
Kant congratulated the IIT-Guwahati fraternity for starting the unique course on e-mobility at the premier technology institute.,0
"“This is a path-breaking initiative because India is in the middle of a mist of technological disruption and revolution. This disruption will lead to a huge and massive shift from combustion vehicles to electric vehicles and we are heading towards a shared and connected zero-emission world,” he said.",0
"Anil Srivastava, mission director of Niti Aayog, said it was looking forward to making more energy-efficient and less-costing batteries.",0
"Speaking during the session, Prof TG Sitharam, director of IIT-Guwahati, said, “From this year, we have introduced a policy such that every academic department should have at least three successful industry advisors who are successful in research and development in industry, so that the curriculum can be inclusive of industry relevant problems over a period of time. If we look at the government’s policy, India wants to achieve 30 percent of e-mobility by 2030”.",0
"Prof. Praveen Kumar, coordinator of the MS(R) programme also spoke at the programme.",0
"At hospitals or on the field, medicos and paramedics dealing with Covid-19 patients and their families continue to brave the risk of assault or misbehaviour.",0
"Though many such incidents have reached police stations, most have been settled on the intervention of superiors in health department as well elders in villages, according to sources.",0
"Most recently, on September 2, residents of a village in Fatehabad district damaged the kits of health workers and assaulted them.",0
A health department team had gone to collect samples of the family members as well as contacts of locals who died of Covid-19.,0
Another such incident happened in Hisar this month when a DSP-level officer allegedly threatened the health team which had gone to paste a poster outside his residence in Hisar.,0
A video of the DSP’s mobile phone conversation with the health team and his wife’s argument with the health team had gone viral .,0
"Haryana health minister Anil Vij, who holds the charge of home department, has maintained that health teams had been provided adequate security.",0
"“The e-vehicles are not required to give much tax. India is a great user of two and three-wheelers and e-vehicles will make a great opportunity in it,” said Srivastava.",0
"He said that industry expert lectures, from India, European Union (EU), and Japan, on topics related to e-mobility such as vehicle design philosophy, light-weighting, new battery chemistries, are planned.",0
Police had registered a case against the accused .,0
Acton is still pending in the incident.,0
As many as 650 teachers will be recruited in government-run schools in the next 10 days.,0
"This was decided at a meeting of the Gujarat State School Management Association, state education minister Bhupendrasinh Chudasama and senior government officials.",0
"“The fifth round of recruitment of teachers will soon be held. Among other decisions, the filling for 1,664 vacant post for principals in various schools was discussed today,” said government sources.",0
It was also proposed at the meeting that some schools that are planning for reduction in classroom numbers should refrain from it.,0
"It was also proposed that in case of rural areas, the classroom strength be 18 students while in the case of urban it be 25",0
"At the meeting it was also decided to approve contingency plan for 11 months to schools that do not have office peons, said sources.",0
"In a tragic incident, three children died of food poisoning after they ate locally purchased biscuits at a remote village in Allagadda mandal in Kurnool district.",0
"According to Allagadda rural SI Prasad, the children (all from the same family) had bought the biscuits from a petty shop in Chintakomma Dinne village on Sunday evening.",0
"Soon after consuming the biscuits with their tea, the children started vomiting and collapsed.",0
The children were immediately rushed to a local hospital where six-year-old Hussain Basha succumbed the same night.,0
The other two children were rushed to the government general hospital in Kurnool but both of them died while undergoing treatment.,0
The children’s parents have called for strict action against the shopkeeper and manufacturer of the biscuits.,0
The district administration has ordered a probe and is waiting for the reports to initiate further action.,0
"The Gujarat high court on Wednesday expressed its dejection with the public and politicians who flout Covid-19 rules and do not cooperate with the authorities, who are putting in hard work to curb the spread of Covid-19.",0
"In an order passed in the suo motu PIL on Covid-19 and the lockdown, the bench of Chief Justice Vikram Nath and Justice J B Pardiwala praised the government for its efforts to control the disease, especially in Surat, and expressed hope that it would continue to work hard on this front.",0
"They said that the HC has done whatever it can, and it can only request people to behave properly.",0
"“We are now left with only one thing to do and that is to request the people at large with folded hands to cooperate with the authorities and follow the norms and protocols prescribed and, more particularly, take care of themselves individually,” the court said.",0
"It further observed, “If each individual takes upon himself the responsibility of protecting his life, such endeavour will surely bring around very good results, and within a short time, we may be able to overcome the Covid 19 pandemic.”",0
"The HC said that in Ahmedabad, it is routinely observed that hundreds of young men and women gather on public streets and at the most happening places in evening and they are not bothered about social distancing at all.",0
Most of them are seen without wearing masks. There must be a similar situation in other cities too.,0
"If people do not obey behavioural guidelines, it is difficult to beat Covid-19.",0
Its high time to behave properly and curb Covid spread instead of keep chasing the virus.,0
The HC also said that youths from the educated class of society are seen in Ahmedabad violating Covid rules.,0
"“If this continues, we will never be able to overcome the pandemic. It is high time we start doing something progressive rather than keep chasing Covid-19 all the time. Life is too short to do all this. Therefore, the norms and protocols, as prescribed by the state government, time to time, need to be scrupulously followed, and this applies even to the political leaders of the state, senior and junior.”",0
"‘Politicians should not flout norms, but lead by example’",0
"The high court took notice of political rallies and gatherings, as pointed out to it during the last hearing on September 4, and it said that rules are applied to people as well as politicians alike.",0
"It said, “The political leaders of the state are expected to lead their masses and not by themselves flouting the norms or the rules and regulations prescribed to combat the pandemic. The flouting of the norms at the end of the political leaders would set a bad example for the people at large, and the same may prompt the people to defy the norms.”",0
"On Thursday, when PM Narendra Modi celebrated his 70th birthday, water levels in the Sardar Sarovar dam at Kevadia Colony in Narmada district reached its peak capacity of 138.68 metres.",0
This is the second time in a year that the dam is brimming to its full capacity.,0
PM Modi too tweeted the video of the overflowing dam and recalled his visit to the spot last year.,0
"Gujarat chief minister, Vijay Rupani performed e-puja from his residence and said, “Water scarcity and droughts are now a thing of past for the state. A dream to make the state water reliant has now come true.”",0
He even tweeted the dam’s photos on Thursday morning.,0
"Minister for state for Narmada development, Yogesh Patel and SSNNL managing director Rajiv Gupta performed puja at the dam site.",0
The dam’s height was increased from 121.92 meters to 138.68 meters in 2017 after a nod from the Supreme Court.,0
The continuous inflow of water from upstream helped the SSNNL authorities in storing the water in a planned manner and ensure it reaches the peak.,0
"The dam is getting an inflow of 71,000 cusecs (cubic foot per second) out of which 51,000 cusecs of water is being discharged downstream of the river.",0
Three units of canal head power house have been made operational.,0
"Water storage in the dam is around 5,760 million cubic meters and it can fulfil the state’s water requirement for nearly two years.",0
"Around 9,000 villages and 165 nagarpalikas and corporations of the state will benefit from the waters.",0
"Prime Minister Narendra Modi had dedicated the dam to the nation on September 17, 2017.",0
A 23-year-old unemployed civil engineer and his 25-year-old friend were caught by police for allegedly selling charas (hash) from a shop.,0
The accused recently took the shop on rent to carry out the illegal activity.,0
"The police nabbed Jigar Dholakia and his friend Parth Tejani, both residents of Katargam for allegedly selling charas.",0
The police booked the accused under the Narcotic Drugs and Psychotropic Substances (NDPS) Act.,0
The investigation has been handed over to Lalgate police station since the raiding team cannot investigate the NDPS cases as per the latest guidelines.,0
"Following specific information, the police raided the shop in Vimalnath Arcade in Katargam on Thursday morning.",0
"During the checking, the police found 2.379 kilogram charas worth Rs 2.37 lakh.",0
"“The accused had contacted some of their known persons to sell charas. We suspect that they had brought a total of 2.500 kg charas of which some quantity has already been sold. We are investigating to find out as to whom they had sold the contraband,” said an official from Katargam police station.",0
The accused had gone to Himachal by bus to buy charas.,0
Dholakia told the police that he had completed civil engineering a year ago and he had been unemployed since then.,0
Parth had studied upto class XII and he had also been jobless since the lockdown. Both had planned to sell charas to make fast bucks.,0
"“Both had no work, and to make easy money they planned to sell charas. They came to know from friends that it was easy to find charas in Himachal, and hence they went there,” added the official.",0
