"The right to life is most critical and for that the narrative must move away from prejudice, demonisation and fear.",0
"Anti-BJP political parties, including the main opposition Congress, while accepting defeat in the battle of ballots, said they would continue to be vocal for the interest of the indigenous people of the state.",0
"State Congress chief Ripun Bora said, “We accept the people’s decision.But, the fight is not over as far as anti-Assam moves are concerned.”",0
"Meanwhile, All Assam Students’ Union (Aasu) said the movement against CAA, implementation of Clause VI of the Assam Accord and for an error-free NRC and elections are different matters.",0
"“A movement can’t be converted to votes all the time because CAA, NRC and Assam Accord were not the only issues,” Dipanka Nath, Aasu president, told TOI.",0
"BJP spokesperson Rupam Goswami said, “CAA and NRC were issues made by the opposition to win elections.But, the election was fought on the issue of development.People understand that development is possible only under the leadership of PM Modi and CM Sarbananda Sonowal.That is why people gave their mandate to NDA.”",0
"Even observers, who felt Trinamool has the edge, did not foresee the scale of Mamata’s win.",0
"She led in 213 of the 294 assembly seats till late Sunday evening, establishing her supremacy in state politics.",0
"The collapse of Congress and Left and failure of their alliance with Furfura Sharif Maulana Abbas Siddiqui helped her cause, but no one could deny Banerjee’s fighting spirit in what was the most important election of her career.",0
"Till rallies were called off, Modi addressed 15 rallies in 12 days and Shah addressed 62 rallies in 28 days, in the state.",0
"A battery of Union cabinet ministers, chief ministers from BJP-ruled states, including Yogi Adityanath, and central BJP leaders campaigned in the state for 117 days.",0
"“If she is so bad, incompetent as they say, why is it that the country’s Prime Minister has to come down three days a week to campaign against her… she must be very powerful then,” asked Gautam Maity (35), a taxi driver in Kolkata.",0
"Meanwhile, the decline of Congress at the national level gives her a chance to position as a grassroots mass-based leader against BJP.",0
"Leaving no doubt that she will lead the charge against BJP at the Centre, Banerjee announced on Sunday that “the Bengal victory for TMC is the beginning of the downslide of the Modi-Shah-led saffron supremacy” in the country.",0
This political experiment was key to Kerala’s four-decade-old alternating LDF and UDF regimes.,0
"This time, LDF managed to make inroads into what UDF had considered as its electoral fixed deposits.",0
"Among the 66 assembly constituencies where Muslim votes play a decisive role in determining the winner, LDF was able to win 45 seats.",0
Even IUML took a beating with its tally coming down from 2016.,0
"Of the 21 seats won by UDF where Muslim votes are decisive, 20 are in Malabar; reflecting the Muslims vote consolidation behind LDF especially in central and south Kerala, where they had to choose between Congress and LDF.",0
"It put out full-page advertisements exclusively in Muslim-management run newspapers on April 6, polling day, proclaiming the front will not implement CAA/NRC and that there won’t be any detention camps in state.",0
And this hasn’t happened overnight.,0
"The speech made by Oommen Chandy’s son, regarding conversion of Hagia Sophia into a mosque in Turkey, did not go well with the church and its bishops.",0
"Though Jacobite church leaders met BJP ahead of the elections, they went back to LDF at the last minute.",0
He was pointing out how the project had not progressed beyond the groundbreaking initiative.,0
"A month later, the DMK youth wing secretary won the Chepauk-Triplicane seat — represented in the past by his grandfather M Karunanidhi — by a margin of over 69,000 votes.",0
"An actor, but not a reluctant political heir, Udhayanidhi tested electoral waters as a campaigner in the 2019 LS election.",0
"In the run-up to the assembly polls, Udhayanidhi and DMK women’s wing secretary Kanimozhi, besides Stalin himself, formed the core campaigning team.",0
"With this win, Udhayanidhi has clearly ensconced himself on the political scene, and is set to go places as he is likely to find a berth in his father’s Cabinet.",0
"KOLKATA: Stray incidents of violence were reported Monday from some areas where voting is underway for the seventh phase of the assembly elections in West Bengal, though the overall polling process has been peaceful with 37.02 per cent turnout till 11 am, officials said.",0
"Long queues were seen outside most polling booths where voting is underway, adhering to Covid protocols, they said.",0
"Voting is being held at 12,068 polling stations spread over nine assembly constituencies each in Murshidabad and Paschim Bardhaman districts, six each in Dakshin Dinajpur and Malda and four in Kolkata, including Chief Minister Mamata Banerjee's home turf Bhabanipur.",0
"""Till 11 am, 37.72 per cent voter turnout was recorded.The polling has been peaceful so far,"" an Election Commission official said.",0
"A few incidents of scuffle were reported from the Asansol area, where TMC candidate Sayoni Ghosh claimed that BJP activists tried to jam booths in her constituency.",0
"The allegation was dubbed as baseless by BJP candidate Agnimitra Paul, who asserted, ""Ghosh is making excuses sensing defeat"".",0
"Meanwhile, there was commotion in Rash Behari constituency after BJP candidate Lt Gen (retd) Subrata Saha's agent was accused of molesting women voters inside a polling booth, police said.",0
"Mohan Rao was detained after several women voters claimed he tried to drag them holding their hands inside Bidya Bharati School, a police officer said.",0
"""We have received a complaint in this regard and a probe is underway,"" the officer said.",0
"In the Jamuria constituency, Left Front candidate Aishe Ghosh alleged that her party agents were stopped from entering the booth by TMC workers, a charge denied by the ruling party.",0
Voting will continue till 6.30 pm.,0
The second wave of coronavirus has hit the country badly.,0
"Amid the grim situation, telemedicine consultation has emerged as an important tool for citizens to seek medical help.",0
"However, like all other digital platforms, there are some loopholes here too that criminals and anti-social elements are trying to take advantage of.",0
The government has asked people to be on their guard and be careful while using online medical consultancy.,0
It has shared security tips for those seeking medical advice online.,0
"In a post on microblogging site Twitter, the government has warned people against fraudsters impersonating as doctors on social media platforms.",0
It further advises users to not make advance payments and be vigilant about making any kind of financial transaction.,0
"CyberDost, the Twitter handle maintained by the Ministry of Home Affairs, has shared these tips online.",0
"It says 1) Fraudsters may impersonate themselves as Doctors on social media platforms and dupe people in the name of Telemedicine/Consultation 2 )Be vigilant before making upfront payment 3) In case of telemedicine, consultation crimes visit your nearest police station or report on www.cybercrime.gov.in #TELEMEDICINE CONSULTATION : PRECAUTIONS https://t.co/zo8n7LM3I4— Cyber Dost (@Cyberdost) 1620226313000Coronavirus infection cases in the country have increased rapidly in the past month.",0
Many parts of the country have reported a shortage of hospital beds and essential medicines.,0
"Consulting doctors online promises a relatively easy, quick and safe method of treatment.",0
Covid-19: Early signs of second wave peaking as growth slows,0
Top Searches Coronavirus in India Mamata Banerjee Supreme Court Covid deaths in India Anil Deshmukh Covid cases in India Bangalore covid cases Covid positivity rate India,0
"For the first time since the beginning of the second wave in mid-February, the seven-day rolling average of daily cases dipped on Friday.",0
"The dip was negligible, just a drop of 118 cases out of the day's total average of over 3.9 lakh.",0
But it indicated a distinct slowing down in the growth of daily cases over the past week.,0
"The seven-day average stood at 3,91,263 on Saturday, having risen by 20,117 in the past week.",0
"The slowdown was evident when one compared this with a growth of 61,173 cases in the previous seven days (April 24-May 1), and a massive increase of 1,06,024 witnessed in the week before (April 17-24).",0
"While the curve is surely bending, the trend needs to continue into the next week before a more definitive statement can be made about the country having reached the peak of the second wave.",0
There were several uncertainties around that.,0
"For one, the positivity rate in the country was still high and increasing.",0
"India recorded a positivity rate of 22% the past three days, up from 21% recorded on the same three days last week.",0
"Besides, the growth in cases remained higher than the national average in states such as Rajasthan and Bihar.",0
"On the positive side, Maharashtra was showing a drop in weekly cases while there was a distinct slowdown in other big Covid-hit states such as Uttar Pradesh, Delhi, Gujarat and Madhya Pradesh.",0
"On Saturday, India recorded 4,01,012 fresh cases.",0
This was the fourth straight day of 4-lakh-plus daily infections in the country.,0
"However, the numbers have declined marginally over the past two days after hitting a peak of 4,14,554 on Thursday.",0
"Active cases in the country continued to rise, although the growth rate had slowed over the past week.",0
"On Saturday, the count of active cases stood at over 37.8 lakh.",0
"Of the 15 districts with positivity rates above 50% for the period, Haryana had four and Arunachal Pradesh and Rajasthan two each.",0
What is striking is that most of these districts are rural ones.,0
"Since the testing numbers are not available, it is not clear whether this is due to inadequate testing or not.",0
"The highest positivity rates for the seven-day period were in Changlang district of Arunachal Pradesh which registered 91.5%, but this is probably more an indication of an extremely low number of tests conducted.",0
"Next on the list were Yanam in Puducherry, Bikaner in Rajasthan, Diban Valley in Arunchal Pradesh and Pali in Rajasthan.",0
The state with the highest proportion of districts on the 20%-plus list is Kerala with 13 of its 14 districts figuring here.,0
"Haryana (19 out of 22), West Bengal (19 out of 23), Delhi (9 out of 11) and Karnataka (24 out of 31) were the others with over 70% of their districts in this worrying list.",0
"All districts in Goa and Puducherry, the lone district in Chandigarh and three out of four in Sikkim were also part of it.",0
Tech giant IBM to start office in Kochi soon,0
"The IBM signboard will be in Kochi only for a few months more, before assuming the new moniker Kyndryl.",0
"Globally, IBM’s ‘managed infrastructure services’ business is being spun-off into an independent new company named Kyndryl, with its headquarters in New York.",0
This new firm will continue with the original IT infrastructure business of IBM and it will enable IBM to focus on more profitable business areas of cloud services and artificial intelligence (AI).,0
"However, there are chances that the transition might be delayed for a few months more, until the end of the calendar year.",0
"However, the transition might be delayed for a few months more, until the end of the calendar year.",0
"IBM is already present in Kochi at Centre A Offices, a premium business centre on MG Road, which houses their coordination office in Kerala with less than five people.",0
It was two-and-a-half years ago that IBM first started scouting in Kochi for a property that could seat five to six people.,0
"Then they came back again eight or nine months ago, leasing a co-working space on MG Road.",0
"A search on IBM India’s career page throws back 457 positions in Kochi, on their website.",0
"MUMBAI: Air India lost two of its employees, senior commander Capt Amitesh Prasad, who was hospitalised with Covid early this month and Johnson Tirkey, a Kolkata-based aircraft maintenance engineer, both of whom passed away on Sunday morning.",0
"Though Air India pilots and employees worked right through lockdown last year and continued to do so in the following months, operating Vande Bharat Mission flights to bring in Indians stranded in other countries, the staff were not put on the priority list for Covid vaccination.",0
"Despite being front line workers, several pilots, cabin crew, engineers and other ground staff are still to get vaccinated for Covid, even as they go about their daily duties at airports.",0
Captain Prasad’s wife too is hospitalised with Covid.,0
"Even as grief and disbelief spread among Air India pilots, other news of deaths due to Covid did rounds on employee groups.",0
The 41-year old passed away at 6.15 am on Sunday morning.,0
"Neither were the pilots nor other ground staff like engineers, airport staff given priority vaccination",0
"Air India announced that the airline had been planning a vaccination drive and waited till May 1 so that all employees, including those under the age of 45 years, could qualify for the shots.",0
The airline said that it plans to complete vaccination for its employees by May end.,0
"“We are in no position to continue risking the lives of our pilots without vaccination,” stated the letter sent by Captain T Praveen Keerthi, general secretary, Indian Commercial Pilots’ Association (ICPA), to Capt R S Sandhu, AI director (operations), last week.",0
“Many crews have been diagnosed Covid positive and are struggling to get oxygen cylinders. We are left to fend for ourselves for hospitalization...”,0
The Covid deaths are not limited to Air India employees.,0
"In the past few weeks, there has been news of pilots and engineers working for private airlines too succumbing to Covid.",0
"During the lockdown, our pilots flew to foreign countries, risking their lives, to bring in Indians stranded abroad.",0
"We operated freighters to transport medicines and now vaccines, oxygen concentrators.",0
Air transport is such an essential service during these times.,0
"Pilots working with private airlines have been transporting vaccines, oxygen concentrators, medicines on domestic flights.",0
"It's like UFC Fight Night all dayJim Carrey gifts brand new Chevy Blazer car to his 'Sonic 2' crew memberDrew Barrymore: My heart goes out to people of India who're trying to hold it togetherOwen Wilson to star in action film 'Secret Headquarters'Chris Lowell boards cast of movie 'My Best Friend's Exorcism'Robert Downey Jr. mourns assistant Jimmy Rich's death, Marvel stars pay respect.",0
"Maayavan Reloaded will have an antagonist from BollywoodJiiva takes vaccine; asks fans if they’ve taken itSakshi Agarwal has a message for bulliesThalaivi actress Kangana Ranaut tests positive for COVID-1928 Years of Master Mahendran- Five memorable performancesArun Pandian underwent angioplasty after testing positive for COVID-19, reveals daughter Keerthi Pandian.",0
"Malayalam actors who are brilliant, but not in the rat race From Mohanlal posing with Santosh Sivan and Priyadarshan to Dulquer Salmaan’s adorable moments with daughter Maryam: Best photos of the week Esther Anil shares stunning pictures from a photoshoot Poornima Indrajith's humorous b'day wish for Indrajith's makeup man Ahaana Krishna pens a moving note about her aunt's death, due to Covid-19 Gokul Suresh plays a wayward youth in a rustic film.",0
KannadaBengali Five indie filmmakers whose short films are creating wavesCelebs gear up to juggle roles as they debut as MLAs Manali celebrates a quiet birthday at home todayJoy Filmfare Awards Bangla 2020: Hand-picked photos from a scintillating showSayantani stars in a film addressing the social taboo on transgendersSean Banerjee: It’s better not to put your guard down.,0
"EnglishMegan Fox on having three sons: It's like UFC Fight Night all dayJim Carrey gifts brand new Chevy Blazer car to his 'Sonic 2' crew memberDrew Barrymore: My heart goes out to people of India who're trying to hold it together Owen Wilson to star in action film 'Secret Headquarters'Chris Lowell boards cast of movie 'My Best Friend's Exorcism'Robert Downey Jr. mourns assistant Jimmy Rich's death, Marvel stars pay respect.",0
"TamilCV Kumar: Maayavan Reloaded will have an antagonist from BollywoodJiiva takes vaccine; asks fans if they’ve taken itSakshi Agarwal has a message for bulliesThalaivi actress Kangana Ranaut tests positive for COVID-1928 Years of Master Mahendran- Five memorable performancesArun Pandian underwent angioplasty after testing positive for COVID-19, reveals daughter Keerthi Pandian.",0
"Malayalam actors who are brilliant, but not in the rat raceFrom Mohanlal posing with Santosh Sivan and Priyadarshan to Dulquer Salmaan’s adorable moments with daughter Maryam: Best photos of the weekEsther Anil shares stunning pictures from a photoshootPoornima Indrajith's humorous b'day wish for Indrajith's makeup manAhaana Krishna pens a moving note about her aunt's death, due to Covid-19Gokul Suresh plays a wayward youth in a rustic film",0
"The experiences of the year gone by tend to make one philosophical and realistic: KM ChaitanyaBy - TNNKAVYA CHRISTOPHERCreated: Mar 1, 2021, 00:00 ISTfacebooktwitterPintrestFilmmaker KM Chaitanya is balancing work between films and TV lately.",0
"Ask him how he’s getting around both visual mediums and he says, “I am more of a cinema person.",0
"For TV, I get involved with the initial part of setting the project going.",0
Working on TV and films are completely different processes.,0
"With a TV show, the story keeps developing based on the feedback by the audience through the TV channel.",0
"So, the channel calls you to discuss what is working or not based on the TRP and you have to constantly adapt the story according to what works,” explains Chaitanya.",0
There is also the difference in the time taken to shoot for each of the mediums.,0
"Luckily, I have an experienced team that can do just that.",0
"You can work with newcomers on a film, but with TV, the crew has to be backed by good experience, it is not possible to function on track without that,” he adds.",0
"Chaitanya too admits, it has been a taxing one, personally.",0
It has been one filled with challenges.,0
The lockdown was announced just when our film Aadhya hit the screens.,0
I took up production of TV shows.,0
"We chose Aakruti, a horror show for TV, and realised the hard way that people do not want to watch horror.",0
"But then again, he recovers, and adds, “I think these experiences make you more philosophical and realistic.",0
Live goes on. The director has begun work on his next TV show.,0
This time we have picked one that dwells on the ever-strong brother-sister sentiment.,0
It is also a remake of a Tamil TV show that has worked well.,0
"It will be on air shortly,” says Chaitantya.",0
"As for his main focus – cinema, Chaitanya says, “I have two scripts ready for two feature films.",0
There is also the series of five short stories being directed by five directors here.,0
"Each one is to be directed by Yogaraj Bhat, Pawan Kumar, Shashank, Jaytheertha and me.",0
"They stories are not independent of each other, they are interlinked.",0
Three of us have completed shoot for our stories.,0
"Incidentally, Pawan has the biggest challenge.",0
"He is required to watch all four stories before he finalises his part of the film, because his story will also conclude the series in a way.",0
"Man makes suicide statement in FB video, hangs himself",0
Top Searches Karnataka lockdown news Karnataka Covid Vaccination Karnataka Covid CasesTejasvi Surya HDFC Bangalore IFSC code CITI Bank Bangalore IFSC.,0
A 28-year-old man went missing on Friday evening soon after posting a video on his Facebook wall about his decision to kill himself.,0
"He was found hanging from a tree in an open space near Koshys College, Chagalahatti village, northeast of Bengaluru, on Saturday morning.",0
His mother Kuppanna rushed to Kothanur police and filed a missing person’s case.,0
Police along with Manjunath’s friends and relatives searched for him the whole night.,0
Police learnt about his location at Chagalahatti village and rushed there by 10am on Saturday.,0
He was found hanging.,0
Jurisdictional Bagalur police were informed about the incident.,0
"A case of abetment to suicide was booked against his friends Pavan, Pooja and Murali based on a complaint filed by Kuppamma.",0
The duo closed the shop due to loss and Pavan agreed to return Rs 11 lakh of Manjunath’s investment.,0
"On Friday, I came to know about my son’s video on Facebook,Kuppamma alleged in the complaint.",0
"Police said Manjunath had to pay money to others, including mobile phone suppliers.",0
He used to threaten them that he would commit suicide if they demanded money.,0
"We are investigating the case from all angles, an officer said.",0
Friends cheated me of Rs 11 lakh’ “My name is Manjunath.,0
He threatened me that he would kill me.,0
He abused me in filthy language for asking for my money.,0
He and Pooja cheated me.,0
Pavan B is the only reason for me taking the extreme step.,0
"It will be proved if anyone checks my call list,” Manjunath said in the one-minute video.",0
"Many live with guilt of infecting, causing death of loved onescityCovid-19: Second wave has launched a deadly assault on lungsworld'People dying in India ,Pak PM Imranindia Actual Covid deaths in most nations way higher than official numbers.",0
Quick Links Coronavirus IndiaBS Yediyurappa Bangalore Metro Siddaramaiah Narayana Murthy HD Kumaraswamy Bangalore Accident.,0
"Sign up from 9am today for vaccine at 136 private, 56 government hospitals in Delhi.",0
Top Searches Coronavirus in India Mamata Banerjee Supreme Court Covid deaths in India Anil Deshmukh Covid cases in India Bangalore covid cases Covid positivity rate India.,0
"News India News Sign up from 9am today for vaccine at 136 private, 56 government hospitals in Delhi.",0
"India is set to enter the second phase of Covid-19 vaccinations on Monday, when registrations will open at 9am for senior citizens (60 years and above) and those aged 45 to 60 years with comorbidities.",0
"For getting the shot, eligible people will have to register on the COWIN 2.0 portal (www.cowin.gov.in) or through other IT applications.",0
"These beneficiaries can choose a vaccination centre at one of the 136 designated private hospitals, where they can get the vaccine at a cost of Rs 250 per dose, including Rs 150 as cost of the vaccine and up to Rs 100 as operational charges.",0
They also have the option of getting a shot free of cost at 56 government hospitals.,0
Vaccinations will be done six days a week at these centres and the details are available at the website of the Delhi government’s health department — www.dshm.delhi.gov.in.,0
"So far, around 1.42 crore doses of the vaccines have been administered among health and frontline workers across the country since the launch of the first phase on January 16.",0
These include around 3.7 lakh beneficiaries in Delhi.,0
"The senior citizen beneficiaries in Delhi include 12.2 lakh people in 60-69 age group, 6.7 lakh people in the 70-79 age group and more than 2.3 lakh beneficiaries who are aged 80 years or above, according to the latest electoral rolls.",0
"Besides, many Cabinet ministers, chief ministers and PM Narendra Modi himself are likely to take the vaccine during this phase, which is expected to give a boost to the drive.",0
"All beneficiaries are advised to carry their Aadhar card, Electoral Photo Identity Card (EPIC) or the photo ID card specified at the time of registration, when they visit a centre for vaccination.",0
The list of 20 specified comorbidities is available at www.dshm.delhi.gov.in.,0
"""Apart from mobilising health workers to reach out to such beneficiaries, district authorities are also roping in RWAs to inform people and create awareness,” said a senior Delhi government official.",0
"Across the country, around 10,000 private hospitals under Ayushman Bharat PMJAY and 687 private hospitals under the Central Government Health Scheme (CGHS) will be utilised for vaccinations.",0
"Besides, state governments can utilise private hospitals empanelled under state health insurance schemes and other programmes.",0
"Apart from this, vaccination will also happen at 10,000 government hospitals.",0
There will be only one live appointment for a beneficiary at any point of time for each dose.,0
Individuals will be able to register on the COWIN portal through mobile numbers.,0
"With one mobile number, a person can register as many as four beneficiaries.",0
"However, all those registered on one mobile number will have nothing in common except the mobile number.",0
The ID card number for each such beneficiary must be different.,0
Appointments for any date for a Covid vaccination centre (CVC) will be closed at 3 pm on that day for which the slots were opened.,0
"For example, for March 1, the slots will be open from 9am till 3pm on the same day and the appointments can be booked any time before that, depending on availability of slots.",0
"However, on March 1, appointments can also be booked for any future date for which vaccination slots are available.",0
A slot for the second dose will also be booked at the same CVC after 28 days have lapsed from the day of the first dose.,0
